show_id,type,title,director,cast,country,date_added,release_year,rating,duration,listed_in,description
s5,TV Show,Kota Factory,,"Mayur More, Jitendra Kumar, Ranjan Raj, Alam Khan, Ahsaas Channa, Revathi Pillai, Urvi Singh, Arun Kumar",India,"September 24, 2021",2021,TV-MA,2 Seasons,"International TV Shows, Romantic TV Shows, TV Comedies","In a city of coaching centers known to train India’s finest collegiate minds, an earnest but unexceptional student and his friends navigate campus life."
s10,Movie,The Starling,Theodore Melfi,"Melissa McCarthy, Chris O'Dowd, Kevin Kline, Timothy Olyphant, Daveed Diggs, Skyler Gisondo, Laura Harrier, Rosalind Chao, Kimberly Quinn, Loretta Devine, Ravi Kapoor",United States,"September 24, 2021",2021,PG-13,104 min,"Comedies, Dramas",A woman adjusting to life after a loss contends with a feisty bird that's taken over her garden — and a husband who's struggling to find a way forward.
s14,Movie,Confessions of an Invisible Girl,Bruno Garotti,"Klara Castanho, Lucca Picon, Júlia Gomes, Marcus Bessa, Kiria Malheiros, Fernanda Concon, Gabriel Lima, Caio Cabral, Leonardo Cidade, Jade Cardozo",,"September 22, 2021",2021,TV-PG,91 min,"Children & Family Movies, Comedies","When the clever but socially-awkward Tetê joins a new school, she'll do anything to fit in. But the queen bee among her classmates has other ideas."
s16,TV Show,Dear White People,,"Logan Browning, Brandon P. Bell, DeRon Horton, Antoinette Robertson, John Patrick Amedori, Ashley Blaine Featherson, Marque Richardson, Giancarlo Esposito",United States,"September 22, 2021",2021,TV-MA,4 Seasons,"TV Comedies, TV Dramas","Students of color navigate the daily slights and slippery politics of life at an Ivy League college that's not nearly as ""post-racial"" as it thinks."
s23,Movie,Avvai Shanmughi,K.S. Ravikumar,"Kamal Hassan, Meena, Gemini Ganesan, Heera Rajgopal, Nassar, S.P. Balasubrahmanyam",,"September 21, 2021",1996,TV-PG,161 min,"Comedies, International Movies","Newly divorced and denied visitation rights with his daughter, a doting father disguises himself as a gray-haired nanny in order to spend time with her."
s25,Movie,Jeans,S. Shankar,"Prashanth, Aishwarya Rai Bachchan, Sri Lakshmi, Nassar",India,"September 21, 2021",1998,TV-14,166 min,"Comedies, International Movies, Romantic Movies","When the father of the man she loves insists that his twin sons marry twin sisters, a woman creates an alter ego that might be a bit too convincing."
s27,Movie,Minsara Kanavu,Rajiv Menon,"Arvind Swamy, Kajol, Prabhu Deva, Nassar, S.P. Balasubrahmanyam, Girish Karnad",,"September 21, 2021",1997,TV-PG,147 min,"Comedies, International Movies, Music & Musicals",A tangled love triangle ensues when a man falls for a woman studying to become a nun — and she falls for the friend he enlists to help him pursue her.
s28,Movie,Grown Ups,Dennis Dugan,"Adam Sandler, Kevin James, Chris Rock, David Spade, Rob Schneider, Salma Hayek, Maria Bello, Maya Rudolph, Colin Quinn, Tim Meadows, Joyce Van Patten",United States,"September 20, 2021",2010,PG-13,103 min,Comedies,"Mourning the loss of their beloved junior high basketball coach, five middle-aged pals reunite at a lake house and rediscover the joys of being a kid."
s32,TV Show,Chicago Party Aunt,,"Lauren Ash, Rory O'Malley, RuPaul Charles, Jill Talley, Ike Barinholtz, Jon Barinholtz, Matthew Craig, Bob Odenkirk, Mike Hagerty, Katie Rich, Chris Witaske",,"September 17, 2021",2021,TV-MA,1 Season,TV Comedies,Chicago Party Aunt Diane is an idolized troublemaker with a talent for avoiding adulthood — and a soft spot for her soul-searching nephew.
s33,TV Show,Sex Education,,"Asa Butterfield, Gillian Anderson, Ncuti Gatwa, Emma Mackey, Connor Swindells, Kedar Williams-Stirling, Alistair Petrie",United Kingdom,"September 17, 2021",2020,TV-MA,3 Seasons,"British TV Shows, International TV Shows, TV Comedies","Insecure Otis has all the answers when it comes to sex advice, thanks to his therapist mom. So rebel Maeve proposes a school sex-therapy clinic."
s38,TV Show,Angry Birds,,"Antti Pääkkönen, Heljä Heikkinen, Lynne Guaglione, Pasi Ruohonen, Rauno Ahonen",Finland,"September 16, 2021",2018,TV-Y7,1 Season,"Kids' TV, TV Comedies","Birds Red, Chuck and their feathered friends have lots of adventures while guarding eggs in their nest that pesky pigs keep trying to steal."
s48,TV Show,The Smart Money Woman,Bunmi Ajakaiye,"Osas Ighodaro, Ini Dima-Okojie, Kemi Lala Akindoju, Toni Tones, Ebenezer Eno, Eso Okolocha DIke, Patrick Diabuah, Karibi Fubara, Temisan Emmanuel, Timini Egbuson",,"September 16, 2021",2020,TV-MA,1 Season,"International TV Shows, Romantic TV Shows, TV Comedies","Five glamorous millennials strive for success as they juggle careers, finances, love and friendships. Based on Arese Ugwu's 2016 best-selling novel."
s68,TV Show,Saved by the Bell,,"Mark-Paul Gosselaar, Tiffani Thiessen, Mario Lopez, Lark Voorhies, Elizabeth Berkley, Dustin Diamond, Dennis Haskins",United States,"September 15, 2021",1994,TV-PG,9 Seasons,"Kids' TV, TV Comedies","From middle school to college, best friends Zack, Kelly, Slater, Jessie, Screech and Lisa take on the highs and lows of life together in this hit series."
s78,Movie,Little Singham - Black Shadow,Prakash Satam,"Sumriddhi Shukla, Jigna Bharadwaj, Sonal Kaushal, Neshma Chemburkar, Ganesh Divekar, Annamaya Verma, Anamay Verma, Manoj Pandey",,"September 11, 2021",2021,TV-Y7,48 min,"Children & Family Movies, Comedies",Kid cop Little Singham loses all his superpowers while trying to stop the demon Kaal’s new evil plans! Can his inner strength help him defeat the enemy?
s79,Movie,Tughlaq Durbar,Delhiprasad Deenadayalan,"Vijay Sethupathi, Parthiban, Raashi Khanna",,"September 11, 2021",2020,TV-14,145 min,"Comedies, Dramas, International Movies",A budding politician has devious plans to rise in the ranks — until an unexpected new presence begins to interfere with his every crooked move.
s80,Movie,Tughlaq Durbar (Telugu),Delhiprasad Deenadayalan,"Vijay Sethupathi, Parthiban, Raashi Khanna",,"September 11, 2021",2021,TV-14,145 min,"Comedies, Dramas, International Movies",A budding politician has devious plans to rise in the ranks — until an unexpected new presence begins to interfere with his every crooked move.
s83,TV Show,Lucifer,,"Tom Ellis, Lauren German, Kevin Alejandro, D.B. Woodside, Lesley-Ann Brandt, Scarlett Estevez, Rachael Harris, Aimee Garcia, Tricia Helfer, Tom Welling, Jeremiah W. Birkett, Pej Vahdat, Michael Gladis",United States,"September 10, 2021",2021,TV-14,6 Seasons,"Crime TV Shows, TV Comedies, TV Dramas","Bored with being the Lord of Hell, the devil relocates to Los Angeles, where he opens a nightclub and forms a connection with a homicide detective."
s85,Movie,Omo Ghetto: the Saga,"JJC Skillz, Funke Akindele","Funke Akindele, Ayo Makun, Chioma Chukwuka Akpotha, Yemi Eberechi Alade, Blossom Chukwujekwu, Deyemi Okanlawon, Alexx Ekubo, Zubby Michael, Tina Mba, Femi Jacobs",Nigeria,"September 10, 2021",2020,TV-MA,147 min,"Action & Adventure, Comedies, Dramas","Twins are reunited as a good-hearted female gangster and her uptight rich sister take on family, crime, cops and all of the trouble that follows them."
s95,Movie,Show Dogs,Raja Gosnell,"Will Arnett, Ludacris, Natasha Lyonne, Stanley Tucci, Jordin Sparks, Gabriel Iglesias, Shaquille O'Neal, Omar Chaparro, Alan Cumming, Andy Beckwith, Delia Sheppard, Kerry Shale","United Kingdom, United States","September 8, 2021",2018,PG,90 min,"Children & Family Movies, Comedies",A rough and tough police dog must go undercover with an FBI agent as a prim and proper pet at a dog show to save a baby panda from an illegal sale.
s98,TV Show,Kid Cosmic,,"Jack Fisher, Tom Kenny, Amanda C. Miller, Kim Yarbrough, Keith Ferguson, Grey Griffin, Lily Rose Silver",United States,"September 7, 2021",2021,TV-Y7,2 Seasons,"Kids' TV, TV Comedies, TV Sci-Fi & Fantasy",A boy's superhero dreams come true when he finds five powerful cosmic stones. But saving the day is harder than he imagined — and he can't do it alone.
s100,TV Show,On the Verge,,"Julie Delpy, Elisabeth Shue, Sarah Jones, Alexia Landeau, Mathieu Demy, Troy Garity, Timm Sharp, Giovanni Ribisi","France, United States","September 7, 2021",2021,TV-MA,1 Season,"TV Comedies, TV Dramas","Four women — a chef, a single mom, an heiress and a job seeker — dig into love and work, with a generous side of midlife crises, in pre-pandemic LA."
s106,Movie,Angamaly Diaries,Lijo Jose Pellissery,"Antony Varghese, Reshma Rajan, Binny Rinky Benjamin, Vineeth Vishwam, Kichu Tellus, Sreekanth Dasan, Sarath Kumar, Tito Wilson, Anandhu, Bitto Davis, Sinoj Varghese",India,"September 5, 2021",2017,TV-14,128 min,"Action & Adventure, Comedies, Dramas","After growing up amidst the gang wars of his hometown, Vincent forms an entrepreneurial squad of his own and ends up on the wrong side of the law."
s107,TV Show,Bunk'd,,"Peyton List, Karan Brar, Skai Jackson, Miranda May, Kevin G. Quinn, Nathan Arenas, Nina Lu",United States,"September 5, 2021",2021,TV-G,5 Seasons,"Kids' TV, TV Comedies","The Ross siblings of Disney's hit series ""Jessie"" spend a summer full of fun and adventure at Maine's Camp Kikiwaka, where their parents first met."
s114,Movie,Afterlife of the Party,Stephen Herek,"Victoria Justice, Midori Francis, Robyn Scott, Adam Garcia, Timothy Renouf, Gloria Garcia, Myfanwy Waring, Spencer Sutherland",,"September 2, 2021",2021,TV-PG,110 min,"Comedies, Romantic Movies",Cassie lives to party... until she dies in a freak accident. Now this social butterfly needs to right her wrongs on Earth if she wants to earn her wings.
s117,Movie,Dhanak,Nagesh Kukunoor,"Krrish Chhabria, Hetal Gada, Vipin Sharma, Gulfam Khan, Suresh Menon, Vijay Maurya, Rajiv Lakshman, Ninad Kamat",India,"September 2, 2021",2015,TV-PG,114 min,"Comedies, Dramas, Independent Movies",A movie-loving 10-year-old and her blind little brother trek to meet Indian superstar Shah Rukh Khan for help in getting the boy an eye operation.
s121,TV Show,Heroes of Goo Jit Zu,,"Jon Allen, Kellen Goff, Joe Hernandez, Kaiji Tang",Australia,"September 2, 2021",2021,TV-Y7,1 Season,"Kids' TV, TV Comedies","After a meteor crash, a group of zoo animals transforms into squishy, gooey and stretchy superheroes with special powers and soon takes on evildoers."
s122,TV Show,Hotel Del Luna,,"Lee Ji-eun, Yeo Jin-goo, Shin Jung-geun, Seo Yi-sook, Bae Hae-sun, Pyo Ji-hoon, Cho Hyun-chul, Kang Hong-suk, Lee Do-hyun, Lee Tae-seon, Kang Mina, Park You-na, Oh Ji-ho",,"September 2, 2021",2019,TV-14,1 Season,"International TV Shows, Romantic TV Shows, TV Comedies","When he's invited to manage a hotel for dead souls, an elite hotelier gets to know the establishment's ancient owner and her strange world."
s126,TV Show,Q-Force,,"Sean Hayes, Wanda Sykes, Laurie Metcalf, David Harbour, Gary Cole, Patti Harrison, Matt Rogers",United States,"September 2, 2021",2021,TV-MA,1 Season,"Crime TV Shows, TV Action & Adventure, TV Comedies","A gay superspy and his scrappy LGBTQ squad fight to prove themselves to the agency that underestimated them. Today, West Hollywood… tomorrow, the world!"
s128,Movie,A Cinderella Story,Mark Rosman,"Hilary Duff, Chad Michael Murray, Jennifer Coolidge, Dan Byrd, Regina King, Julie Gonzalo, Lin Shaye, Madeline Zima, Andrea Avery, Mary Pat Gleason, Paul Rodriguez, Whip Hubley, Kevin Kilner, Erica Hubbard, Simon Helberg","United States, Canada","September 1, 2021",2004,PG,95 min,"Children & Family Movies, Comedies",Teen Sam meets the boy of her dreams at a dance before returning to toil in her stepmother's diner. Can her lost cell phone bring them together?
s133,TV Show,Brave Animated Series,,"Tseng Yun-fan, Kao Yun-shuo, Chiang Ching-yen, Meng Ching-fu, Huang Bai-wei, Ma Kuo-yao, Chen Yen-chun, Sun Ke-fang, Kai Yang-niu, Chen Yu-wen, Nick Liao, Lin Kai-ling, Mickey Huang, Liu Kuan-ting, Jiang Du-hui",,"September 1, 2021",2021,TV-MA,1 Season,"International TV Shows, TV Action & Adventure, TV Comedies",A group of superheroes sets out to rid the world of evil — only to realize they may not be standing on the side of justice. Based on a popular comic.
s138,Movie,Crocodile Dundee in Los Angeles,Simon Wincer,"Paul Hogan, Linda Kozlowski, Jere Burns, Jonathan Banks, Aida Turturro, Alec Wilson, Gerry Skilton, Steve Rackman, Serge Cockburn, Paul Rodriguez, Mark Adair-Rios, Tiriel Mora, Grant Piro, Mike Tyson","Australia, United States","September 1, 2021",2001,PG,95 min,"Action & Adventure, Comedies","When Mick ""Crocodile"" Dundee and his family land in Los Angeles, they soon learn some lessons about American life in this comedy sequel."
s140,Movie,Do the Right Thing,Spike Lee,"Danny Aiello, Ossie Davis, Ruby Dee, Richard Edson, Giancarlo Esposito, Spike Lee, Bill Nunn, John Turturro, Paul Benjamin, Frankie Faison, Samuel L. Jackson, Rosie Perez, Martin Lawrence, Miguel Sandoval",United States,"September 1, 2021",1989,R,120 min,"Classic Movies, Comedies, Dramas","On a sweltering day in Brooklyn, simmering racial tensions between residents rise to the surface and ignite rage, violence and tragedy."
s145,Movie,House Party,Reginald Hudlin,"Christopher Reid, Christopher Martin, Robin Harris, Tisha Campbell, A.J. Johnson, Martin Lawrence, Paul Anthony, Bowlegged Lou, B-Fine, Edith Fields, Kelly Jo Minter, Clifton Powell, Verda Bridges",United States,"September 1, 2021",1990,R,104 min,"Comedies, Cult Movies","Grounded by his strict father, Kid risks life and limb to go to his best friend Play's big bash but experiences one obstacle after another."
s146,Movie,House Party 2,"George Jackson, Doug McHenry","Christopher Reid, Christopher Martin, Martin Lawrence, Bowlegged Lou, Paul Anthony, B-Fine, Tisha Campbell, Kamron, Iman, Queen Latifah",United States,"September 1, 2021",1991,R,94 min,"Comedies, Cult Movies, Music & Musicals","Kid goes off to college with scholarship money but when Play loses Kid's tuition funds to a shady music promoter, they devise a wild plan to raise cash."
s147,Movie,House Party 3,Eric Meza,"Christopher Reid, Christopher Martin, Tisha Campbell, David Edwards, Angela Means, Ketty Lester, Bernie Mac, Michael Colyar, Chris Tucker, Khandi Alexander",United States,"September 1, 2021",1994,R,94 min,"Comedies, Music & Musicals","After Kid gets engaged, Play plans to throw the biggest bachelor party ever. But every celebration for these two always comes with complications."
s150,Movie,I Got the Hook Up,Michael Martin,"Master P, Anthony Johnson, Gretchen Palmer, Frantz Turner, Richard Keats, Joe Estevez, William Knight, Anthony Boswell, Tommy 'Tiny' Lister, Helen Martin, John Witherspoon, Mia X",United States,"September 1, 2021",1998,R,93 min,"Action & Adventure, Comedies","After getting their hands on a misdirected shipment of cell phones, two hustlers try to cash in by hawking the merchandise from the back of their van."
s153,Movie,Janoskians: Untold and Untrue,Brett Weiner,"Jai Brooks, Luke Brooks, James Yammouni, Daniel Sahyounie, Beau Brooks",United States,"September 1, 2021",2016,TV-MA,88 min,Comedies,Follow the story of three Australian brothers and their two friends who became an international sensation by posting pranks and gags on YouTube.
s157,Movie,Letters to Juliet,Gary Winick,"Amanda Seyfried, Christopher Egan, Gael García Bernal, Vanessa Redgrave, Franco Nero, Luisa Ranieri, Marina Massironi, Milena Vukotic, Marcia DeBonis, Luisa De Santis, Lidia Biondi, Giordano Formenti, Chris Egan",United States,"September 1, 2021",2010,PG,105 min,"Comedies, Dramas, Romantic Movies","By responding to a letter addressed to Shakespeare's tragic heroine Juliet Capulet, an American woman in Verona, Italy, is led in search of romance."
s159,Movie,Love Don't Cost a Thing,Troy Byer,"Nick Cannon, Christina Milian, Kenan Thompson, Kal Penn, Steve Harvey, Al Thompson, Ashley Monique Clark, Elimu Nelson, Nichole Robinson, Melissa Schuman",United States,"September 1, 2021",2003,PG-13,101 min,"Comedies, Romantic Movies",A nerdy teen tries to make himself cool by association when he convinces a popular cheerleader to pose as his girlfriend.
s160,Movie,Love in a Puff,Pang Ho-cheung,"Miriam Chin Wah Yeung, Shawn Yue, Singh Hartihan Bitto, Isabel Chan, Cheung Tat-ming, Matt Chow, Chui Tien-you, Queenie Chu, Charmaine Fong, Vincent Kok",Hong Kong,"September 1, 2021",2010,TV-MA,103 min,"Comedies, Dramas, International Movies","When the Hong Kong government enacts a ban on smoking cigarettes indoors, the new law drives hard-core smokers outside, facilitating unlikely connections."
s161,TV Show,Major Dad,,"Gerald McRaney, Shanna Reed, Nicole Dubuc, Chelsea Hertford, Marisa Ryan, Matt Mulhern, Beverly Archer, Jon Cypher",United States,"September 1, 2021",1992,TV-PG,4 Seasons,TV Comedies,"When he marries a journalist and becomes stepdad to her daughters, a U.S. Marine finds his once-orderly life no longer entirely under his command."
s162,Movie,Mars Attacks!,Tim Burton,"Jack Nicholson, Glenn Close, Annette Bening, Pierce Brosnan, Danny DeVito, Martin Short, Sarah Jessica Parker, Michael J. Fox, Rod Steiger, Tom Jones, Lukas Haas, Natalie Portman",United States,"September 1, 2021",1996,PG-13,106 min,"Comedies, Cult Movies, Sci-Fi & Fantasy","As flying saucers head for Earth, the president of the United States prepares to welcome alien visitors but soon learns they're not coming in peace."
s164,Movie,My Boss's Daughter,David Zucker,"Ashton Kutcher, Tara Reid, Jeffrey Tambor, Andy Richter, Michael Madsen, Jon Abrahams, David Koechner, Carmen Electra, Kenan Thompson, Terence Stamp, Molly Shannon",United States,"September 1, 2021",2003,R,86 min,"Comedies, Romantic Movies","A young man house-sits for his mean boss, hoping to use it as an opportunity to win the heart of the boss's daughter, on whom he's long had a crush."
s165,Movie,Mystery Men,Kinka Usher,"Ben Stiller, Hank Azaria, William H. Macy, Janeane Garofalo, Kel Mitchell, Paul Reubens, Wes Studi, Greg Kinnear, Geoffrey Rush, Lena Olin, Eddie Izzard, Artie Lange, Pras, Claire Forlani, Tom Waits",United States,"September 1, 2021",1999,PG-13,121 min,"Action & Adventure, Comedies",A team of far-from-super heroes try to earn respect by springing into action when brave and dashing Captain Amazing disappears.
s168,Movie,Open Season 2,"Matthew O'Callaghan, Todd Wilderman","Joel McHale, Mike Epps, Jane Krakowski, Billy Connolly, Crispin Glover, Steve Schirripa, Georgia Engel, Diedrich Bader, Cody Cameron, Fred Stoller, Olivia Hack","United States, Canada","September 1, 2021",2008,PG,76 min,"Children & Family Movies, Comedies",Elliot the buck and his forest-dwelling cohorts must rescue their dachshund pal from some spoiled pets bent on returning him to domesticity.
s169,Movie,Osmosis Jones,"Bobby Farrelly, Peter Farrelly","Chris Rock, Laurence Fishburne, David Hyde Pierce, Brandy Norwood, William Shatner, Ron Howard, Kid Rock, Ben Stein",United States,"September 1, 2021",2001,PG,95 min,"Action & Adventure, Children & Family Movies, Comedies",Peter and Bobby Farrelly outdo themselves with this partially animated tale about an out-of-shape 40-year-old man who's the host to various organisms.
s173,Movie,School of Rock,Richard Linklater,"Jack Black, Joan Cusack, Mike White, Sarah Silverman, Lee Wilkof, Kate McGregor-Stewart, Adam Pascal, Suzzanne Douglas, Miranda Cosgrove, Kevin Alexander Clark, Joey Gaydos Jr., Robert Tsai, Veronica Afflerbach, Jordan-Claire Green","United States, Germany","September 1, 2021",2003,PG-13,110 min,"Comedies, Music & Musicals","Musician Dewey Finn gets a job as a fourth-grade substitute teacher, where he secretly begins teaching his students the finer points of rock 'n' roll."
s177,Movie,The Golden Child,Michael Ritchie,"Eddie Murphy, J.L. Reate, Charles Dance, Charlotte Lewis, Victor Wong, Randall Tex Cobb, James Hong, Shakti Chen, Tau Logo, Tiger Chung Lee",United States,"September 1, 2021",1986,PG-13,94 min,"Action & Adventure, Comedies",A fast-talking L.A. social worker goes through a series of traps and terrors to find a kidnapped Tibetan child with mystical powers.
s179,Movie,The Interview,"Evan Goldberg, Seth Rogen","James Franco, Seth Rogen, Lizzy Caplan, Randall Park, Diana Bang, Timothy Simons, Reese Alexander, James Yi",United States,"September 1, 2021",2014,R,112 min,"Action & Adventure, Comedies",Seth Rogen and James Franco star in this provocative comedy about two journalists recruited by the CIA after they arrange an interview with Kim Jong-un.
s180,Movie,The Nutty Professor,Tom Shadyac,"Eddie Murphy, Jada Pinkett Smith, James Coburn, Larry Miller, Dave Chappelle, John Ales, Patricia Wilson, Jamal Mixon",United States,"September 1, 2021",1996,PG-13,95 min,"Comedies, Romantic Movies","After being made fun of for his weight, a kind and brainy professor takes a dose of a revolutionary formula that changes more than just his appearance."
s181,Movie,The Nutty Professor II: The Klumps,Peter Segal,"Eddie Murphy, Janet Jackson, Larry Miller, John Ales, Richard Gant, Anna Maria Horsford, Melinda McGraw, Jamal Mixon, Gabriel Williams, Chris Elliott",,"September 1, 2021",2000,PG-13,107 min,"Comedies, Romantic Movies","After getting engaged, Sherman Klump prepares for his big day. But his sinister alter ego Buddy Love threatens to ruin his wedding and reputation."
s183,Movie,Welcome Home Roscoe Jenkins,Malcolm D. Lee,"Martin Lawrence, James Earl Jones, Joy Bryant, Margaret Avery, Mike Epps, Mo'Nique, Cedric the Entertainer, Nicole Ari Parker, Michael Clarke Duncan, Louis C.K.",United States,"September 1, 2021",2008,PG-13,114 min,Comedies,"R.J. travels to Georgia for his parents' 50th anniversary. But after pompously flaunting his Hollywood lifestyle, he must examine what he's become."
s187,TV Show,Hometown Cha-Cha-Cha,,"Shin Min-a, Kim Seon-ho, Lee Sang-yi, Gong Min-jeung, Kim Young-ok, Cho Han-cheul, In Gyo-jin, Lee Bong-ryeon, Cha Cheong-hwa, Kang Hyung-suk",,"August 29, 2021",2021,TV-14,1 Season,"International TV Shows, Romantic TV Shows, TV Comedies","A big-city dentist opens up a practice in a close-knit seaside village, home to a charming jack-of-all-trades who is her polar opposite in every way."
s188,TV Show,The Ingenuity of the Househusband,,Kenjiro Tsuda,,"August 29, 2021",2021,TV-G,1 Season,"International TV Shows, TV Comedies",A tough guy with a knack for housework tackles household tasks with meticulous care in these comedic live-action vignettes.
s189,Movie,2 Alone in Paris,"Ramzy Bedia, Éric Judor","Ramzy Bedia, Éric Judor, Benoît Magimel, Kristin Scott Thomas, Élodie Bouchez, Édouard Baer, Fred Testot, Omar Sy",France,"August 28, 2021",2008,TV-MA,97 min,"Comedies, International Movies","A bumbling Paris policeman is doggedly determined to capture the master thief that repeatedly eludes him, even when they're the last two men on Earth."
s190,TV Show,Bread Barbershop,,"Um Sang-hyun, Park Yoon-hee, Kang Shi-hyun, Hong Bum-ki, Kim Hyun-wook, Lee In-suk, Song Ha-rim",,"August 28, 2021",2020,TV-Y,2 Seasons,"Kids' TV, TV Comedies","In a town filled with food, Bread is a master cake decorator who gives life-changing makeovers that will put any customer in an amazing mood."
s193,Movie,C Kkompany,Sachin Yardi,"Mithun Chakraborty, Tusshar Kapoor, Anupam Kher, Rajpal Yadav, Raima Sen, Dilip Prabhavalkar, Sanjay Mishra",India,"August 27, 2021",2008,TV-14,127 min,"Action & Adventure, Comedies, International Movies","Three broke friends pose as an underworld gang for extortion, but their plan takes on a life of its own when their phony company becomes famous."
s196,Movie,EMI: Liya Hai To Chukana Padega,Saurabh Kabra,"Sanjay Dutt, Arjun Rampal, Malaika Arora, Aashish Chaudhary, Neha Uberoi, Urmila Matondkar, Manoj Joshi, Daya Shankar Pandey, Pushkar Jog, Kulbhushan Kharbanda",India,"August 27, 2021",2008,TV-14,128 min,"Comedies, Dramas, International Movies",A bank hires an enigmatic and unorthodox debt collector to recover money from four borrowers who are unable to pay their loans.
s197,Movie,He's All That,Mark Waters,"Addison Rae, Tanner Buchanan, Rachael Leigh Cook, Madison Pettis, Isabella Crovetti, Matthew Lillard, Peyton Meyer, Annie Jacob, Myra Molloy, Kourtney Kardashian",,"August 27, 2021",2021,TV-14,92 min,"Comedies, Romantic Movies","An influencer specializing in makeovers bets she can transform an unpopular classmate into prom king in this remake of the teen classic ""She's All That."""
s198,TV Show,I Heart Arlo,,"Michael J. Woodard, Mary Lambert, Jonathan Van Ness, Haley Tju, Brett Gelman, Tony Hale, Vincent Rodriguez III, Annie Potts, Jessica Williams, Melissa Villaseñor, Cathy Vu, Jennifer Coolidge, Flea",,"August 27, 2021",2021,TV-Y7,1 Season,"Kids' TV, TV Comedies",It's a whole new world for Arlo and his one-of-a kind pals when they set out to restore a run-down New York City neighborhood — and make it their own.
s200,Movie,Koi Aap Sa,Partho Mitra,"Aftab Shivdasani, Natassha, Dipannita Sharma, Himanshu Mallik, Vaidya Advai, Pushy Anand, Shama Deshpande, Rajendra Gupta",India,"August 27, 2021",2006,TV-14,135 min,"Comedies, Dramas, International Movies","Star athlete Rohan has his eye on a beautiful art student. But when his best friend Simran experiences a crisis, he drops everything to help her."
s203,Movie,Kyaa Kool Hai Hum,Sangeeth Sivan,"Tusshar Kapoor, Riteish Deshmukh, Isha Koppikar, Neha Dhupia, Anupam Kher, Jay Sean",India,"August 27, 2021",2005,TV-MA,165 min,"Comedies, International Movies, Music & Musicals","Longtime friends Rahul and Karan head to Mumbai intent on making their dreams come true, but both men are suddenly saddled with bad luck."
