show_id,type,title,director,cast,country,date_added,release_year,rating,duration,listed_in,description
s4164,TV Show,Z Nation,,"Nat Zang, Russell Hodgkinson, Michael Welch, Anastasia Baranova, Kellita Smith, DJ Qualls, Keith Allan, Pisay Pao",United States,"January 27, 2019",2018,TV-MA,5 Seasons,"TV Action & Adventure, TV Comedies, TV Horror","A team embarks on a perilous cross-country mission to transport the one man who survived a deadly zombie virus, hoping he holds the key to a vaccine."
s4168,TV Show,Club of Crows,,"Luis Gerardo Méndez, Mariana Treviño, Stephanie Cayo, Daniel Giménez Cacho, Alosian Vivancos, Antonio de la Vega, Ianis Guerrero, Juan Pablo de Santiago, Joaquín Ferreira, Said Sandoval, Andrés Pardave, Sofía Niño de Rivera, Eileen Yañez, Gutemberg Brito, Claudia Vega, Verónica Terán, Jesús Zavala, Gustavo Ganem, Ricardo Polanco, Emilio Guerrero, Luis Rábago, Guillermo Dorantes, Richie Mestre, Sofía Sisniega, Aldo Escalante, Juan Luis Orendain, Marcela Álvarez",Mexico,"January 25, 2019",2019,TV-MA,4 Seasons,"International TV Shows, Spanish-Language TV Shows, TV Comedies",A brother and sister battle high expectations and each other after inheriting a soccer team. A series from the creators of “Nosotros los Nobles.”
s4170,Movie,Mi Obra Maestra,Gastón Duprat,"Guillermo Francella, Luis Brandoni, Raúl Arévalo, Andrea Frigerio, María Soldi, Mónica Duprat, Mahmoud Azim, Santiago Korovsky, Julio Marticorena, Alejandro Paker","Argentina, Spain","January 25, 2019",2018,TV-MA,105 min,"Comedies, International Movies","A sly art dealer tries to revive the career of his longtime pal, a surly painter, with a risky plan that tests their morals and friendship."
s4172,TV Show,The Perfect Match,,"Wu Kang-jen, Ivy Shao, Ben Wu, Xiao Man, Nylon Chen",,"January 25, 2019",2017,TV-14,1 Season,"International TV Shows, Romantic TV Shows, TV Comedies","A night market vendor clashes with a lofty celebrity chef in a culinary challenge, fueling the first sparks of a romance."
s4188,Movie,Adhugo,,,India,"January 15, 2019",2018,TV-14,105 min,"Comedies, Independent Movies, International Movies",A fast-footed piglet named Bunty becomes an object of desire for rival criminals that want the swift swine for their profitable animal-racing schemes.
s4199,Movie,All of You,Dan Villegas,"Jennylyn Mercado, Derek Ramsay, Yayo Aguila, Kean Cipriano, Nico Antonio, Enzo Marcos, Via Antonio, Hannah Ladesma",Philippines,"January 11, 2019",2017,TV-MA,104 min,"Comedies, Dramas, International Movies","Two strangers meet on a dating app and experience instant chemistry, but their relationship unravels as jarring differences catch up to them."
s4201,TV Show,Friends from College,,"Keegan-Michael Key, Cobie Smulders, Billy Eichner, Fred Savage, Nat Faxon, Annie Parisse, Jae Suh Park",United States,"January 11, 2019",2019,TV-MA,2 Seasons,"Romantic TV Shows, TV Comedies","Twenty years after graduation, a tight-knit group of college friends reconnects and discovers that love hasn't gotten easier with age."
s4202,TV Show,Hardy Bucks,,"Martin Maloney, Owen Colgan, Chris Tordoff, Peter Cassidy, Tom Kilgallon, Michael Salmon, Wayne Lynch, Tommy Miller",Ireland,"January 11, 2019",2018,TV-MA,4 Seasons,TV Comedies,"A circle of young men entertain vague ambitions involving quick cash, women and showbiz in this mockumentary on small-town Irish life in County Mayo."
s4203,TV Show,Horrid Henry,,"Lizzie Waterworth, Joanna Ruiz, Emma Tate, Sue Elliot Nicholls, Tamsin Heatley, Wayne Forester, Aidan Cook, Stephanie Anne Mills, David Holt",United Kingdom,"January 11, 2019",2019,TV-Y7,2 Seasons,"British TV Shows, Kids' TV, TV Comedies","To his family's frustration, Henry is skilled at making trouble, from babysitting pets in his bedroom to starting a shark panic at the swimming pool."
s4206,Movie,The Last Laugh,Greg Pritikin,"Chevy Chase, Richard Dreyfuss, Andie MacDowell, Kate Micucci, Chris Parnell, George Wallace, Lewis Black",United States,"January 11, 2019",2019,TV-MA,99 min,"Comedies, Dramas","After moving to a retirement home, restless talent manager Al reconnects with long-ago client Buddy and coaxes him back out on the comedy circuit."
s4210,Movie,Next Enti?,Kunal Kohli,"Navdeep, Larissa Bonesi, Sarathbabu, Tamannaah Bhatia, Sundeep Kishan, Poonam Kaur",India,"January 9, 2019",2018,TV-14,117 min,"Comedies, Dramas, International Movies","Clashing views on intimacy lead a couple to go their separate ways to reflect on commitment and companionship, before suddenly crossing paths again."
s4215,Movie,Lionheart,Genevieve Nnaji,"Genevieve Nnaji, Nkem Owoh, Pete Edochie, Onyeka Onwenu, Kanayo O. Kanayo",Nigeria,"January 4, 2019",2018,TV-PG,95 min,"Comedies, Dramas, Independent Movies","When her father falls ill, Adaeze steps up to run the family business – alongside her uncle – and prove herself in a male-dominated world."
s4218,Movie,Monty Python and the Holy Grail,"Terry Gilliam, Terry Jones","Graham Chapman, John Cleese, Eric Idle, Terry Gilliam, Terry Jones, Michael Palin, Connie Booth, Carol Cleveland, Neil Innes",United Kingdom,"January 2, 2019",1975,PG,92 min,"Action & Adventure, Classic Movies, Comedies",The Monty Python comedy clan skewers King Arthur and his Knights of the Round Table as they quest far and wide for the Holy Grail.
s4219,TV Show,A Series of Unfortunate Events,,"Neil Patrick Harris, Patrick Warburton, Malina Weissman, Louis Hynes, K. Todd Freeman, Joan Cusack, Aasif Mandvi",United States,"January 1, 2019",2019,TV-PG,3 Seasons,"Kids' TV, TV Action & Adventure, TV Comedies","The extraordinary Baudelaire orphans face trials, tribulations and the evil Count Olaf in their fateful quest to unlock long-held family secrets."
s4220,Movie,Back to the 90s,Yanyong Kuruaungkoul,"Dan Aaron Ramnarong, Pimchanok Leuwisetpaiboon, Chanintorn Jitpreeda, Chonlakarn Puangnoy, Achita Pramoj Na Ayudhya, Vichuda Pindum, Kriengsak Hrientong, Likit Sittiphun",Thailand,"January 1, 2019",2015,TV-14,111 min,"Comedies, International Movies, Music & Musicals","When a teenager is transported back to his parents’ high school days, he has the chance to alter the events that led to their unhappy marriage."
s4221,TV Show,COMEDIANS of the world,,"Neal Brennan, Chris D'Elia, Nicole Byer, Nick Swardson, DeAnne Smith, Ivan Decker, Dave Merheje, K. Trevor Wilson, Joel Dommett, Mae Martin, Nish Kumar, Ellie Taylor, Urzila Carlson, Joel Creasey, Nazeem Hussain, Cal Wilson, Riaad Moosa, Tumi Morake, Loyiso Gola, Loyiso Madinga, Atul Khatri, Aditi Mittal, Amit Tandon, Franco Escamilla, Hugo El Cojo Feliz, Gaby Llanas, Enissa Amani, Ilka Bessin, Kaya Yanar, Thiago Ventura, Mhel Merrer, Afonso Padilha, Shirley Souagnon, Jason Brokerss, Tania Dutel, Donel Jack'sman, Ibraheem Alkhairallah, Rawsan Hallak, Adi Khalefa, Moayad Alnefaie, Louis-José Houde, François Bellefeuille, Katherine Levac, Adib Alkhalidey, Martijn Koning, Soundos El Ahmadi, Rayen Panday",United States,"January 1, 2019",2019,TV-MA,13 Seasons,"Stand-Up Comedy & Talk Shows, TV Comedies",This global stand-up comedy series features a diverse set of comics from 13 regions bringing their perspectives on what's funny around the world.
s4242,Movie,Secrets in the Hot Spring,,"Chang Ting-hu, Hong Yan-xiang, Lin He Xuan, Kuo Shu-yao, Law Kar-Ying, Mimi Chu",Taiwan,"December 31, 2018",2018,TV-14,108 min,"Comedies, Horror Movies, International Movies","When three teen outcasts arrive at a hot springs hotel to help run things, creepy incidents prompt comical efforts to find what lurks in their midst."
s4255,TV Show,Hashoter Hatov,,"Moshe Ivgy, Guy Loel, Yuval Semo, Yigal Adika, Avi Shnaidman, Vered Feldman, Liora Rivlin",Israel,"December 28, 2018",2015,TV-MA,1 Season,"Crime TV Shows, International TV Shows, TV Comedies",An honest – though overzealous – police officer strives to do good work while dealing with his bickering parents and incompetent coworkers.
s4256,Movie,Life Ki Toh Lag Gayi,Rakesh Mehta,"Kay Kay Menon, Ranvir Shorey, Manu Rishi Chadha, Pradhuman Singh, Neha Bhasin, Jackie Shroff, Asrani, Neeraj Vora, Sharat Saxena, Tom Alter",India,"December 28, 2018",2012,TV-MA,109 min,"Action & Adventure, Comedies, Dramas","A vengeful son, a cop on a mission, a wannabe actress and a jilted lover find their lives intermingling in unexpected ways over 24 hours in Mumbai."
s4261,TV Show,Stand Up and Away! with Brian Regan,,Brian Regan,United States,"December 24, 2018",2018,TV-PG,1 Season,"Stand-Up Comedy & Talk Shows, TV Comedies",Brian Regan blends his trademark observational stand-up with short sketches and a bit of audience interaction in this hybrid comedy series.
s4262,TV Show,Way Back into Love,,"June Tsai, Ray Chang, Lung Shao-hua, Yi-Wen Yen, Ching-kuan Wang, Mai Sato",Taiwan,"December 24, 2018",2011,TV-14,1 Season,"International TV Shows, Romantic TV Shows, TV Comedies","After years in the U.S., a Taiwanese immigrant returns to her hometown with a young daughter in tow to assist her father with his bed-and-breakfast."
s4265,TV Show,People Just Do Nothing,,"Allan Mustafa, Hugo Chegwin, Asim Chaudhry, Lily Brazier, Olivia Jasmine Edwards, Dan Sylvester, Steve Stamp, Ruth Bratt, George Keywood, Maria Louis",United Kingdom,"December 22, 2018",2018,TV-MA,5 Seasons,"British TV Shows, TV Comedies",Spinning old-school beats is just another day at the office for the naive DJs of a pirate radio station who juggle family life with their passion.
s4268,Movie,Bad Seeds,Kheiron,"Kheiron, Catherine Deneuve, André Dussollier, Louison Blivet, Adil Dehbi, Hakou Benosmane, Youssouff Wague, Mahia Zrouki, Joseph Jovanovic","France, Belgium","December 21, 2018",2018,TV-MA,105 min,"Comedies, Dramas, International Movies","Troubled by his past, a scam artist who runs a petty racket with his adoptive mom finds redemption while mentoring a group of difficult students."
s4270,TV Show,Jojo's World,,"Tia Lee, In Deok Hwang, Yen-j, Jason Hsu, Andy Wu, Sharon Hsu",Taiwan,"December 21, 2018",2017,TV-14,1 Season,"International TV Shows, Romantic TV Shows, TV Comedies","Diagnosed with a condition that could make her infertile, a career woman must choose one of four bachelors to make a baby with before time runs out."
s4272,TV Show,Lion Pride,,"Yen Tsao, Amanda Chou, Kevin Liu, Peace Yang, Kenny Wen, Tzu-chiang Chao, Vince Kao, Lin Ching-Tai, Lin He Xuan, Michael Yang",Taiwan,"December 21, 2018",2017,TV-MA,1 Season,"International TV Shows, Romantic TV Shows, TV Comedies","After crossing paths at a crime scene, a renowned math teacher and an antiques appraiser embark on an unexpected journey of love and self-discovery."
s4285,TV Show,Ellen DeGeneres: Relatable,"Joel Gallen, Tig Notaro",Ellen DeGeneres,United States,"December 18, 2018",2018,TV-MA,1 Season,"Stand-Up Comedy & Talk Shows, TV Comedies","In her first special since 2003, Ellen revisits her road to stardom and details the heartfelt – and hilarious – lessons she's learned along the way."
s4287,Movie,Prince of Peoria: A Christmas Moose Miracle,Jon Rosenbaum,"Gavin Lewis, Theodore Barnes, Shelby Simmons, Cynthia Kaye McWilliams",United States,"December 17, 2018",2018,TV-G,29 min,"Children & Family Movies, Comedies","Teddy's never missed the Festival of Lights, but the bowling alley’s been snowed in! Not to worry – Emil insists the Christmas moose will save the day."
s4288,Movie,Andhadhun,Sriram Raghavan,"Tabu, Ayushmann Khurrana, Radhika Apte, Anil Dhawan, Manav Vij, Zakir Hussain, Ashwini Kalsekar, Chhaya Kadam, Pawan Singh, Kabir Sajid",India,"December 16, 2018",2018,TV-14,137 min,"Comedies, Dramas, International Movies",A visually impaired pianist’s world careens into a series of shocking twists after he unintentionally lands at the murder scene of a former film star.
s4289,TV Show,Ashes of Love,,"Yang Zi, Deng Lun, Luo Yunxi",China,"December 16, 2018",2018,TV-14,1 Season,"International TV Shows, Romantic TV Shows, TV Comedies","Hidden away by her mother, the Floral Goddess, the naïve Jinmi is drawn to Xufeng, the Heavenly Emperor's son. Yet forces conspire against them."
s4290,Movie,Dragons: Dawn of the Dragon Racers,"Elaine Bogan, John Sanford","Jay Baruchel, America Ferrera, Zack Pearlman, Christopher Mintz-Plasse, T.J. Miller, Andree Vermeulen",United States,"December 16, 2018",2014,TV-PG,27 min,"Children & Family Movies, Comedies","The ""How to Train Your Dragon"" adventure continues when a hunt for lost sheep turns into a fierce, fun-filled competition."
s4291,TV Show,DreamWorks Holiday Classics,,"Ben Stiller, David Schwimmer, Chris Rock, Jada Pinkett Smith, Jay Baruchel, Gerard Butler, Craig Ferguson, America Ferrera, Eddie Murphy, Mike Myers, Antonio Banderas, Cameron Diaz",United States,"December 16, 2018",2011,TV-PG,1 Season,"Kids' TV, TV Comedies","Join your DreamWorks friends for these four holiday specials, featuring Shrek and Donkey, Hiccup and Toothless, and the wacky animals from Madagascar."
s4293,Movie,Maps to the Stars,David Cronenberg,"Julianne Moore, Mia Wasikowska, Robert Pattinson, John Cusack, Olivia Williams, Sarah Gadon, Evan Bird, Niamh Wilson, Dawn Greenhalgh","Canada, Germany, France, United States","December 16, 2018",2014,R,112 min,"Comedies, Dramas",A showbiz family revolving around its teen celebrity son desperately tries to hang on to fame and success in this savage satire of Hollywood.
s4297,TV Show,Flowers,,"Olivia Colman, Julian Barratt, Daniel Rigby, Sophia Di Martino, Leila Hoffman, Will Sharpe, Harriet Walter",United Kingdom,"December 15, 2018",2018,TV-MA,2 Seasons,"British TV Shows, International TV Shows, TV Comedies","Between a troubled marriage, a senile granny and twin siblings constantly in rivalry, a crumbling household struggles to barely keep it together."
s4298,Movie,Kita Kita,Sigrid Andrea Bernardo,"Alessandra de Rossi, Empoy Marquez",Philippines,"December 15, 2018",2017,TV-14,84 min,"Comedies, Dramas, International Movies","When a tour guide in Japan goes blind after seeing her fiancé’s infidelity, she befriends a fellow Filipino keen to coax her out of the darkness."
s4308,TV Show,The Fix,,"Jimmy Carr, D.L. Hughley, Katherine Ryan",United States,"December 14, 2018",2018,TV-MA,1 Season,TV Comedies,"Comedians Jimmy Carr, D.L. Hughley and Katherine Ryan tackle the world's woes with help from a rotating crew of funny guests and an actual expert."
s4316,Movie,5 Star Christmas,Marco Risi,"Massimo Ghini, Ricky Memphis, Martina Stella, Ralph Palka, Biagio Izzo, Riccardo Rossi, Paola Minaccioni",Italy,"December 7, 2018",2018,TV-14,96 min,"Comedies, International Movies","When the Italian prime minister meets his lover and political rival while on an official trip to Budapest during Christmas week, things go topsy-turvy."
s4318,Movie,Dumplin',Anne Fletcher,"Danielle Macdonald, Jennifer Aniston, Odeya Rush, Maddie Baillio, Bex Taylor-Klaus, Luke Benward, Georgie Flores, Dove Cameron, Harold Perrineau, Kathy Najimy, Ginger Minj, Hilliary Begley",United States,"December 7, 2018",2018,PG-13,110 min,"Comedies, Dramas, Independent Movies","To prove a point about measuring up and fitting in, Texas teen Willowdean Dickson enters a local pageant run by her ex-beauty queen mom."
s4321,TV Show,Neo Yokio,,"Jaden Smith, Jude Law, Tavi Gevinson, Susan Sarandon, Desus Nice, The Kid Mero, Richard Ayoade, Willow Smith, Kiernan Shipka, Jason Schwartzman, Amandla Stenberg, Ray Wise",United States,"December 7, 2018",2018,TV-MA,2 Seasons,"TV Comedies, TV Sci-Fi & Fantasy, Teen TV Shows","Joined by his faithful mecha-butler, Kaz Kaan pursues love, fashion and supernatural forces amid Neo Yokio's sinister high society."
s4327,TV Show,The Sound of Your Heart: Reboot,,"Sung Hoon, Kwon Yuri, Tae Hang-ho, Joo Jin-mo, Shim Hye-jin, Ji Su-won, Park Cheol-min, Kim Seong-won, Kang Yoon, Seo Eun-ah, Bae Yoon-kyung",South Korea,"December 3, 2018",2018,TV-14,2 Seasons,"International TV Shows, Korean TV Shows, TV Comedies","Webtoonist Cho Seok is back with more anecdotes of mix-ups, unintended antics, and bathroom blunders in this reboot starring an all-new cast."
s4329,Movie,Teefa in Trouble,Ahsan Rahim,"Ali Zafar, Maya Ali, Javed Sheikh, Mehmood Aslam, Faisal Qureshi, Nayyar Ejaz, Asma Abbas, Marhoom Ahmad Bilal, Simi Raheal, Salman Bokhari",Pakistan,"December 2, 2018",2018,TV-14,155 min,"Action & Adventure, Comedies, International Movies","A gangster hires goon Teefa to abduct his friend’s daughter for an arranged marriage, but things get tricky when Teefa develops feelings for the girl."
s4334,Movie,Blind Detective,Johnnie To,"Andy Lau, Sammi Cheng, Gao Yuanyuan, Guo Tao, Philip Keung, Lam Suet, Lo Hoi-pang, Tai-Lo Ma, Man-Wai Wong, Ying-Ying Yiu, Yi Zi","Hong Kong, China","December 1, 2018",2013,TV-MA,130 min,"Action & Adventure, Comedies, International Movies","When a cop loses his vision, his detecting skills stay sharp. Luckily, a rookie officer recognizes his extraordinary powers of deduction."
s4335,Movie,Break Up 100,Lawrence Cheng,"Ekin Cheng, Chrissie Chow, Ivana Wong, Jase Ho, Alex Lam, Wen Xin, Miriam Chin Wah Yeung, Eric Kot, Kar Lok Chin",Hong Kong,"December 1, 2018",2014,TV-14,105 min,"Comedies, International Movies, Romantic Movies","After their 99th breakup, a career woman and her carefree partner open a cafe where customers can put up souvenirs of past relationships."
s4336,Movie,Chal Bhaag,Prakash Balwant Saini,"Deepak Dobriyal, Tarun Bajaj, Keeya Khanna, Varun Mehra, Sanjay Mishra, Yashpal Sharma, Mukesh Tiwari, Atul Srivastava, Manish Khanna, Kunwar Aziz",India,"December 1, 2018",2014,TV-14,110 min,"Comedies, Dramas, International Movies",Three petty criminals find themselves in a pickle when police wrongly charge them with the murder of an important politician.
s4338,Movie,Don't Go Breaking My Heart,Johnnie To,"Louis Koo, Gao Yuanyuan, Daniel Wu",Hong Kong,"December 1, 2018",2011,TV-PG,115 min,"Comedies, International Movies, Romantic Movies","A financial analyst succumbs to a love triangle with a hard-drinking architect and a promiscuous investment bro, who soon becomes her boss."
s4339,Movie,Don't Go Breaking My Heart 2,Johnnie To,"Louis Koo, Gao Yuanyuan, Miriam Chin Wah Yeung, Vic Chou, Daniel Wu","Hong Kong, China","December 1, 2018",2014,TV-14,113 min,"Comedies, International Movies, Romantic Movies","Zixin is about to marry Qihong, but her gallivanting ex returns to wreak havoc as mistaken identities and love triangles stir up the lovers' paradise."
s4344,Movie,Look for a Star,Andrew Lau Wai-Keung,"Andy Lau, Qi Shu, Zhang Hanyu, Denise Ho, Dominic Lam, Xinyi Zhang, David Chiang, George Lam, Rebecca Pan, Maria Cordero, Tat-Ming Cheung",Hong Kong,"December 1, 2018",2009,TV-14,117 min,"Comedies, International Movies, Romantic Movies","While keeping his identity secret, a real estate billionaire tries to woo an outspoken croupier who talks gamblers out of losing their money."
s4346,Movie,Once a Gangster,Felix Chong,"Ekin Cheng, Jordan Chan, Alex Fong, Michelle Ye, On-on Yu, Wilfred Lau, Conroy Chan",Hong Kong,"December 1, 2018",2010,TV-MA,95 min,"Action & Adventure, Comedies, International Movies","Two former triads are tapped to run in an election for leader of the underworld, but both want normal lives. Each must outwit the other to lose."
s4349,Movie,SDU: Sex Duties Unit,Gary Mak,"Chapman To, Shawn Yue, Matt Chow, Kwok Cheung Tsang",Hong Kong,"December 1, 2018",2013,TV-MA,96 min,"Comedies, International Movies",Four man-children in an elite tactical unit gallivant around Macau for a weekend of debauchery that gets them in trouble with the law.
s4359,Movie,Rajma Chawal,Leena Yadav,"Rishi Kapoor, Anirudh Tanwar, Amyra Dastur, Jitendra Shastri, Aparshakti Khurana, Harish Khanna, Manu Rishi Chadha, Nirmal Rishi, Sheeba Chaddha, Adil Hussain, Rahul Ram, Mukesh Chhabra",India,"November 30, 2018",2018,TV-MA,119 min,"Comedies, Dramas, International Movies","Hoping to revive his relationship with his resentful millennial son, an internet-rookie widower assumes the online persona of a young woman."
s4361,Movie,The World Is Yours,Romain Gavras,"Isabelle Adjani, Karim Leklou, François Damiens, Vincent Cassel, Oulaya Amamra",France,"November 30, 2018",2018,TV-MA,101 min,"Action & Adventure, Comedies, International Movies","To escape his life of crime, a Paris drug dealer takes on one last job involving Spain, unhinged gangsters, his longtime crush and his scheming mother."
s4363,TV Show,Bumping Mics with Jeff Ross & Dave Attell,,"Jeff Ross, Dave Attell",United States,"November 27, 2018",2018,TV-MA,1 Season,"Stand-Up Comedy & Talk Shows, TV Comedies","When Jeff Ross and Dave Attell take the stage, no one is safe. With the help of special guests, they're packing a lot of laughs into one epic weekend."
s4368,TV Show,Sick Note,,"Rupert Grint, Nick Frost, Don Johnson, Lindsay Lohan, Pippa Bennett-Warner, Marama Corlett, Karl Theobald, Belinda Stewart-Wilson, Camilla Beeput, Dustin Demri-Burns, Tolu Ogunmefun",United Kingdom,"November 23, 2018",2018,TV-MA,2 Seasons,"British TV Shows, International TV Shows, TV Comedies","After slacker Daniel Glass is misdiagnosed with cancer, his lies lead him into an absurd web of fraud, blackmail, suspicion and misadventure."
s4369,TV Show,Mystery Science Theater 3000: The Return,,"Felicia Day, Patton Oswalt, Jonah Ray, Baron Vaughn, Hampton Yount",United States,"November 22, 2018",2018,TV-14,2 Seasons,"TV Comedies, TV Sci-Fi & Fantasy","The cult hit returns! Captured by mad scientists, new host Jonah survives a blitz of cheesy B movies by riffing on them with his funny robot pals."
s4370,Movie,The Christmas Chronicles,Clay Kaytis,"Kurt Russell, Darby Camp, Judah Lewis, Kimberly Williams-Paisley, Oliver Hudson, Lamorne Morris, Martin Roach",United States,"November 22, 2018",2018,TV-PG,104 min,"Children & Family Movies, Comedies","After accidentally crashing Santa's sleigh, a brother and sister pull an all-nighter to save Christmas with a savvy, straight-talking St. Nick."
s4371,Movie,The Tribe,Fernando Colomo,"Paco León, Carmen Machi, Luis Bermejo, Maribel del Pino, Maite Sandoval, Arlette Torres, Marisol Aznar, María José Sarrate, Manuel Huedo, Artur Busquets",Spain,"November 21, 2018",2018,TV-MA,91 min,"Comedies, International Movies","An executive-turned-viral sensation loses his reputation and his memory, but finds a new life with his biological mother and her empowered dance group."
s4373,TV Show,Paap-O-Meter,,,,"November 20, 2018",2017,TV-Y7,1 Season,"Kids' TV, TV Comedies","A trio of sky-dwelling ghosts must travel to Earth to teach sinning humans a lesson, but they somehow manage to botch each well-intentioned mission."
s4374,Movie,Puppy Star Christmas,Robert Vince,"Kaitlyn Maher, Mackenzie Sol, Makenzie Moss, David DeLuise, George Newbern, Reggie De Leon, Diedrich Bader, Chloe Coleman, Oakley Bull, Dillon Fontana, vivienne Rutherford, Tyreese Burnett","United States, Canada","November 20, 2018",2018,PG,91 min,"Children & Family Movies, Comedies","A new pack of Pup Star pooches stumbles upon a rival team’s plan to ruin Christmas, then ends up at the North Pole to try and save the holiday spirit."
s4376,Movie,Target,Raditya Dika,"Raditya Dika, Cinta Laura Kiehl, Samuel Rizal, Willy Dozan, Abdur Arsyad, Hifdzi Khoir, Romy Rafael, Ria Ricis, Anggika Bolsterli",Indonesia,"November 20, 2018",2018,TV-14,91 min,"Comedies, Horror Movies, International Movies","Trapped in an empty building, nine people are forced to play a lethal game. All their movements will be recorded, and only one player can survive."
s4382,TV Show,Silvana Sin Lana,,"Maritza Rodríguez, Carlos Ponce, Marimar Vega, Adriana Barraza, Marcela Guirado, Ricardo Abarca, Thali García, Alexandra Pomales, Briggitte Bozzo, Santiago Torres, Patricio Gallardo, Roberto Escobar, Samantha Dagnino, Raury Rolander, Vince Miranda, Javier Valcárcel",United States,"November 17, 2018",2016,TV-14,1 Season,"Romantic TV Shows, Spanish-Language TV Shows, TV Comedies","When her fugitive husband leaves her homeless and penniless, a once-wealthy woman has no other choice but to join the working class."
s4384,Movie,Nothing to Hide,Fred Cavayé,"Bérénice Bejo, Suzanne Clément, Stéphane De Groodt, Vincent Elbaz, Grégory Gadebois, Doria Tillier, Roschdy Zem, Fleur Fitoussi","France, Belgium","November 16, 2018",2018,TV-MA,94 min,"Comedies, Dramas, International Movies","To spice up a dinner party, old friends agree to share every private message that pops up on their phones – with disastrous results."
s4386,Movie,The Ballad of Buster Scruggs,"Joel Coen, Ethan Coen","Liam Neeson, James Franco, Tim Blake Nelson, Tom Waits, Zoe Kazan, Brendan Gleeson",United States,"November 16, 2018",2018,R,133 min,"Comedies, Dramas","Ranging from absurd to profound, these Western vignettes from the Coen brothers follow the adventures of outlaws and settlers on the American frontier."
s4391,Movie,Christmas Wedding Planner,Justin G. Dyck,"Stephen Huszar, Kelly Rutherford",Canada,"November 15, 2018",2017,PG,86 min,"Comedies, International Movies, Romantic Movies",A wedding planner’s world is turned upside down when a handsome private investigator is hired to disrupt one of her biggest jobs.
s4392,Movie,Halkaa,Nila Madhab Panda,"Tathastu, Aryan Preet, Ranvir Shorey, Paoli Dam, Kumud Mishra, Devender Chaudhary, Shrikant Verma",India,"November 15, 2018",2018,TV-14,111 min,"Comedies, Dramas, Independent Movies","Up against a corrupt government official and crushing poverty, a young boy in the Delhi slums attempts to raise funds to build himself his own toilet."
s4395,Movie,Odu Raja Odu,"Nishanth Ravindaran, Jathin Sanker Raj","Guru Somasundaram, Nasser, Anand Sami, Lakshmi Priyaa Chandramouli, Ashiqa Salvan, Ravindra Vijay, Abishek K.S., Venkatesh Harinathan",India,"November 15, 2018",2018,TV-14,121 min,"Comedies, Independent Movies, International Movies","While trying to buy his wife a set-top box, a struggling writer and his pal get entangled in the domino effect of a spectacularly botched drug deal."
