show_id,type,title,director,cast,country,date_added,release_year,rating,duration,listed_in,description
s2075,Movie,Soldier,Abbas Mustan,"Rakhee Gulzar, Bobby Deol, Preity Zinta",India,"September 1, 2020",1998,TV-14,155 min,"Comedies, Dramas, International Movies","On the run from Indian police, a mysterious man escapes to Australia and falls in love with the daughter of an Indian criminal who lives there."
s2077,Movie,The Boss Baby: Get That Baby!,"Dan Forgione, Pete Jacobs, Matt Whitlock","JP Karliak, Pierce Gagnon, Alex Cazares, Kevin Michael Richardson, Flula Borg, Rhys Darby, Wendie Malick, Jake Green",United States,"September 1, 2020",2020,TV-Y7,115 min,"Children & Family Movies, Comedies",Think you've got what it takes to be the boss? This interactive special puts your skills to the test and matches you up with one of 16 jobs at Baby Corp.
s2080,Movie,The Smurfs,Raja Gosnell,"Hank Azaria, Neil Patrick Harris, Jayma Mays, Sofía Vergara, Tim Gunn, Jonathan Winters, Katy Perry, Alan Cumming, Fred Armisen, George Lopez, Anton Yelchin, Kenan Thompson, Jeff Foxworthy, John Oliver, Wolfgang Puck, B.J. Novak, Paul Reubens","United States, Belgium, Canada, France","September 1, 2020",2011,PG,103 min,"Children & Family Movies, Comedies","When evil Gargamel tries to capture them, the Smurfs flee their woodland home, pass through a magic portal and find themselves stranded in New York."
s2083,Movie,Maniyarayile Ashokan,Shamzu Zayba,"Jacob Gregory, S.V. Krishna Shankar, Shine Tom Chacko, Vijayaraghavan, Sri Lakshmi, Anupama Parameswaran, Dulquer Salmaan, Nazriya Fahad",India,"August 31, 2020",2020,TV-14,110 min,"Comedies, International Movies, Romantic Movies","When his unlucky horoscope doesn’t bode well for his future wife, an earnest bachelor goes to surprising lengths to get the family he’s always wanted."
s2087,TV Show,Masaba Masaba,,"Masaba Gupta, Neena Gupta, Neil Bhoopalam, Rytasha Rathore, Smaran Sahu, Nayan Shukla, Pooja Bedi, Satyadeep Misra",India,"August 28, 2020",2020,TV-MA,1 Season,"International TV Shows, TV Comedies, TV Dramas","Real life mom-daughter duo Neena and Masaba Gupta play versions of themselves in this playful, fictional peek into their lives in fashion and film."
s2091,Movie,Edge of Seventeen,David Moreton,"Chris Stafford, Tina Holmes, Andersen Gabrych, Stephanie McVay, Lea DeLaria, John Eby, Antonio Carriero, Jason Lockhart",United States,"August 27, 2020",1998,TV-MA,103 min,"Comedies, Dramas, Independent Movies",A 17-year-old confronts confusion and heartbreak as he rediscovers his sexuality in this story about coming out and its social consequences.
s2103,TV Show,Ojos in d' House,,"'Najite Dede, Jude Chukwuka, Taiwo Arimoro, Odenike Odetola, Funmi Eko, Keppy Ekpenyong",Nigeria,"August 22, 2020",2013,TV-G,1 Season,"International TV Shows, TV Comedies","After a newly rich family moves into an upper-class neighborhood, they try to keep their matriarch's obsessive pursuit of social acceptance in check."
s2106,TV Show,Hoops,,"Jake Johnson, Ron Funches, Cleo King, Natasha Leggero, A.D. Miles, Rob Riggle, Steve Berg, Eric Edelstein, Ben Hoffman, Mary Holland, Gil Ozeri, Sam Richardson, Nick Swardson",United States,"August 21, 2020",2020,TV-MA,1 Season,TV Comedies,A foul-mouthed high school basketball coach is sure he'll hit the big leagues if he can only turn his terrible team around. Good luck with that.
s2108,Movie,The Sleepover,Trish Sie,"Sadie Stanley, Maxwell Simkins, Ken Marino, Malin Akerman, Cree Cicchino, Lucas Jaye, Karla Souza, Enuka Okuma, Erik Griffin, Joe Manganiello",United States,"August 21, 2020",2020,TV-PG,104 min,"Action & Adventure, Children & Family Movies, Comedies",What do you do if your parents are kidnapped by a crew of international thieves? You begin a wild overnight adventure — complete with spy gear.
s2111,Movie,Scarecrow,Khaled Marei,"Ahmed Helmy, Menna Shalaby, Khaled El Sawy, Bayoumi Fouad, Entsar, Samy Maghawry, Mahmoud Ellisy, Yasser El Tobgy, Hassan Hosny, Lotfy Labib",Egypt,"August 20, 2020",2019,TV-MA,121 min,"Comedies, International Movies","When his former partners vote to sell off a pricey piece of stolen jewelry, a thief recruits his grandson to help him retain it and repent for his deed."
s2115,Movie,Little Singham: Kaal Ka Badla,Prakash Satam,"Anamaya Verma, Arushi Talwar, Ganesh Divekar, Jigna Bhardwaj, Krishna Dasadiya, Neshma Chemburkar, Manoj Pandey, Parminder Ghumman, Pranav Vaidya, Saumya Daan, Sonal Kaushal, Sumriddhi Shukla",,"August 19, 2020",2020,TV-Y7,70 min,"Children & Family Movies, Comedies","Little Singham’s biggest enemy, the demon Kaal, is back and badder than ever — but this time, will he succeed in destroying the world’s best kid cop?"
s2116,Movie,Drunk Parents,Fred Wolf,"Alec Baldwin, Salma Hayek, Jim Gaffigan, Joe Manganiello, Treat Williams, Ben Platt, Aasif Mandvi, Natalia Cigliuti",United States,"August 18, 2020",2019,R,97 min,Comedies,Two desperate parents go to extreme lengths to hide their dire financial straits from their daughter and friends.
s2117,Movie,Meet the In-Laws,Niyi Akinmolayan,"Adeniyi Johnson, Tina Mba, Dele Odule, Lilian Esoro, Amaechi Muonagor, Blessing Onwukwe, Dayo Amusa, Kenneth Okolie",Nigeria,"August 18, 2020",2017,TV-PG,75 min,"Comedies, Dramas, International Movies","When their respective parents oppose their union, a newly engaged couple learns that the reasons for pushback run deeper than just tribal differences."
s2118,Movie,Crazy Awesome Teachers,Sammaria Sari Simanjuntak,"Gading Marten, Dian Sastrowardoyo, Faradina Mufti, Boris Bokir, Kevin Ardilova, Shakira Jasmine, Asri Welas, Arswendi Bening Swara, Kiki Narendra, Ibnu Jamil",Indonesia,"August 17, 2020",2020,TV-PG,102 min,"Comedies, Dramas, International Movies","When staff salaries get stolen at his school, a reluctant new teacher sets out to recoup the money and soon discovers the joys of teaching."
s2125,TV Show,Rita,,"Mille Dinesen, Carsten Bjørnlund, Lise Baastrup, Nikolaj Groth, Ellen Hillingsø, Morten Vang Simonsen, Lykke Sand Michelsen, Carsten Norgaard, Sara Hjort Ditlevsen, Alexandre Willaume",Denmark,"August 15, 2020",2020,TV-MA,5 Seasons,"International TV Shows, TV Comedies, TV Dramas","Independent, outspoken and adored by her students, schoolteacher Rita fares less well with adults in this comedy-drama from Denmark."
s2127,Movie,What's Your Raashee?,Ashutosh Gowariker,"Harman Baweja, Priyanka Chopra, Manju Singh, Anjan Srivastav, Darshan Jariwala, Dilip Joshi, Vishwa Badola, Rajesh Vivek, Daya Shankar Pandey, Yuri Suri",India,"August 15, 2020",2009,TV-PG,203 min,"Comedies, International Movies, Music & Musicals","To protect his family from ruin, Yogesh must marry his dream girl in only ten days, so he rushes into dating women with different astrological signs."
s2130,Movie,Fearless,Cory Edwards,"Yara Shahidi, Miles Robbins, Miguel J. Pimentel, Gabrielle Union, Jadakiss, Tom Kenny, Angie Martinez, Harland Williams, Fat Joe, Amari McCoy, Dwyane Wade",Canada,"August 14, 2020",2020,TV-Y7,92 min,"Children & Family Movies, Comedies",A teen gamer is forced to level up to full-time babysitter when his favorite video game drops three superpowered infants from space into his backyard.
s2134,TV Show,Teenage Bounty Hunters,,"Anjelica Bette Fellini, Maddie Phillips, Kadeem Hardison, Virginia Williams, Mackenzie Astin, Shirley Rumierk, Myles Evans, Devon Hales, Spencer House, Eric Graise, Charity Cervantes, Wynn Everett, Method Man",United States,"August 14, 2020",2020,TV-MA,1 Season,"Crime TV Shows, TV Comedies, TV Dramas",Twin sisters Sterling and Blair balance teen life at an elite Southern high school with an unlikely new career as butt-kicking bounty hunters.
s2138,Movie,An Easy Girl,Rebecca Zlotowski,"Mina Farid, Zahia Dehar, Benoît Magimel, Nuno Lopes, Clotilde Courau, Loubna Abidar, ""Riley"" Lakdhar Dridi, Henri-Noël Tabary",France,"August 13, 2020",2019,TV-MA,93 min,"Comedies, Dramas, International Movies",A teen girl is drawn to her cousin’s hedonistic lifestyle when they spend the summer together in Cannes as she learns about herself and her own values.
s2143,Movie,Mr. Peabody & Sherman,Rob Minkoff,"Ty Burrell, Max Charles, Ariel Winter, Stephen Colbert, Leslie Mann, Stanley Tucci, Allison Janney, Mel Brooks, Patrick Warburton, Stephen Tobolowsky, Lake Bell",United States,"August 11, 2020",2014,PG,93 min,"Children & Family Movies, Comedies, Sci-Fi & Fantasy","Resurrected from the 1960s animated series ""Rocky and Bullwinkle,"" canine genius Mr. Peabody and young Sherman take a dizzying ride through time."
s2145,TV Show,GAME ON: A Comedy Crossover Event,,"Loretta Devine, Tia Mowry-Hardrict, Anthony Alabi, Paul Wight, Allison Munn, Gabriel Iglesias, Sherri Shepherd, Paulina Chávez, Jencarlos Canela",United States,"August 10, 2020",2020,TV-G,1 Season,"Kids' TV, TV Comedies","Worlds collide in this special event featuring familiar faces, surprise cameos and stories of spirited competition from four different comedy series."
s2151,Movie,"Berlin, Berlin: Lolle on the Run",Franziska Meyer Price,"Felicitas Woll, Janina Uhse, Jan Sosniok, Matthias Klimsa, Sandra Borgmann, Kai Lentrodt, Armin Rohde, Gitta Schweighöfer, Kailas Mahadevan",Germany,"August 7, 2020",2020,TV-MA,82 min,"Comedies, International Movies","In this cinematic sequel to the hit TV series, Lolle has moved on from Sven and is about to marry her friend Hart – until Sven disrupts her plans."
s2160,Movie,Work It,Laura Terruso,"Sabrina Carpenter, Jordan Fisher, Liza Koshy, Keiynan Lonsdale, Michelle Buteau, Drew Ray Tanner",United States,"August 7, 2020",2020,TV-14,94 min,Comedies,A brilliant but clumsy high school senior vows to get into her late father’s alma mater by transforming herself and a misfit squad into dance champions.
s2168,Movie,Malibu Rescue: The Next Wave,Savage Steve Holland,"Ricardo Hurtado, Breanna Yde, Jackie R. Jacobson, Abby Donnelly, Alkoya Brunson, Jeff Meacham, Ella Gross, Carlos Sanson, JT Neal, Camaron Engels, Kirrilee Berger",United States,"August 4, 2020",2020,TV-G,71 min,"Children & Family Movies, Comedies","As summer returns to Malibu, Team Flounder takes to the beach to host — and unexpectedly compete in — the International Beachmaster Competition."
s2172,Movie,Almost Love,Mike Doyle,"Scott Evans, Augustus Prew, Kate Walsh, Michelle Buteau, Zoë Chao, Patricia Clarkson, Colin Donnell, Christopher Gray",United States,"August 2, 2020",2020,TV-MA,92 min,"Comedies, Dramas, Independent Movies",A close crew of striving New Yorkers experiences both joy and heartache in their romantic and professional lives.
s2173,Movie,Killing Hasselhoff,Darren Grant,"Ken Jeong, David Hasselhoff, Jim Jefferies, Jon Lovitz, Rhys Darby, Dan Bakkedahl, Jennifer Ikeda, Will Sasso, Colton Dunn",United States,"August 1, 2020",2017,R,80 min,Comedies,"In major debt to a loan shark, a nightclub owner who's entered in a celebrity death pool tries to murder a famous figure for half a million dollars."
s2174,TV Show,Moesha,,"Brandy Norwood, William Allen Young, Sheryl Lee Ralph, Countess Vaughn, Lamont Bentley, Shar Jackson, Marcus T. Paulk, Yvette Wilson",United States,"August 1, 2020",2000,TV-PG,6 Seasons,"TV Comedies, Teen TV Shows","Navigating the twists and firsts of high school, Moesha juggles friendships, romance and the occasional drama while trying to keep her family together."
s2186,Movie,Latte and the Magic Waterstone,"Regina Welker, Nina Wels","Ashley Bornancin, Carter Hastings",Germany,"July 31, 2020",2020,TV-Y,83 min,"Children & Family Movies, Comedies","When a greedy bear steals a magic stone to keep the forest’s water for himself, a brave hedgehog and a timid squirrel must work together to retrieve it."
s2188,Movie,Seriously Single,"Katleho Ramaphakela, Rethabile Ramaphakela","Fulu Mugovhani, Tumi Morake, Bohang Moeko, Yonda Thomas",South Africa,"July 31, 2020",2020,TV-MA,108 min,"Comedies, International Movies, Romantic Movies","While her free-living bestie urges her to embrace singlehood, a commitment-craving social media expert can't stop following the life of a former love."
s2194,Movie,Uma Maheswara Ugra Roopasya,Venkatesh Maha,"Satya Dev, VK Naresh, Raghavan, Suhas P, Ravindra Vijay, Chandana Koppisetti, Roopa Koduvayur, Kushalini Pulapa",India,"July 30, 2020",2020,TV-MA,137 min,"Comedies, Dramas, Independent Movies","Defeated and humiliated in a fight while trying to defuse a conflict among his fellow villagers, a photographer vows revenge on his attacker."
s2195,TV Show,Unlucky Ploy,Nopparoj Chotmunkongsit,"Anusorn Maneethet, Atsadaporn Siriwattanakul, Waratthaya Wongchayaporn, Thanawetch Siriwattanakul, Pokchat Thiamchai, Phichikorn Ployphimana, Supachai Suwanon, Daraneenuch Pasutanavin, Kittiphong Dumavibhat, Aphiradi Phawaphutanon, Attharut Krongrasri, Ronnawee Sereerat, Lita Janvarapa, Sitang Punnapob, Yani Tramod",,"July 30, 2020",2020,TV-MA,1 Season,"International TV Shows, Romantic TV Shows, TV Comedies","In this remake of the Korean series, a man becomes mired in the lives of two women who happen to share the same name."
s2196,Movie,It's Her Day,Aniedi Anwah,"Bovi Ugboma, Amanda Ebeye, Shaffy Bello, Adunni Ade, Ini Dima-Okojie, 'Najite Dede, Gregory Ojefua, Thelma Ezeamaka, Femi Durojaiye, Ese Lami George, Toni Tones",Nigeria,"July 29, 2020",2016,TV-MA,112 min,"Comedies, International Movies, Romantic Movies","After a man promises his fiancé a dream wedding, he must keep up with her outrageous requests to have the most lavish ceremony possible."
s2203,Movie,Banana Split,Ben Kasulke,"Hannah Marks, Liana Liberato, Dylan Sprouse, Luke Spencer Roberts, Jessica Hecht, Addison Riecke, Meagan Kimberly Smith, Haley Ramm",United States,"July 26, 2020",2020,TV-MA,84 min,"Comedies, Dramas, Independent Movies","Despite leaving for college, a heartsick teen tries to build a new friendship with a kindred spirit even though she's dating her ex-boyfriend."
s2204,TV Show,Shameless (U.S.),,"William H. Macy, Emmy Rossum, Justin Chatwin, Cameron Monaghan, Jeremy Allen White, Shanola Hampton, Steve Howey, Ethan Cutkosky, Emma Kenney, Laura Wiggins, Joan Cusack",United States,"July 26, 2020",2019,TV-MA,10 Seasons,"TV Comedies, TV Dramas",This dramedy based on a British series centers on siblings in a dysfunctional Chicago family who struggle while coping with their alcoholic father.
s2205,Movie,Door Ke Darshan,Gagan Puri,"Dolly Ahluwalia, Manu Rishi Chadha, Mahie Gill, Shardul Rana, Archita Sharma, Rajesh Sharma, Supriya Shukla, Mehak Manwani",India,"July 25, 2020",2020,TV-14,114 min,"Comedies, International Movies","When a matriarch wakes from a 30-year coma, her wacky family frantically recreates a bygone era to keep her from noticing how much time has passed."
s2208,Movie,Animal Crackers,"Tony Bancroft, Scott Christian Sava","Emily Blunt, John Krasinski, Ian McKellen, Danny DeVito, Raven-Symoné, Patrick Warburton, Wallace Shawn, Gilbert Gottfried, Tara Strong, Harvey Fierstein, James Arnold Taylor, Kevin Grevioux, Sylvester Stallone, Lydia Rose Taylor","China, Spain, South Korea, United States","July 24, 2020",2020,TV-Y7,106 min,"Children & Family Movies, Comedies","Enchanted animal crackers turn Owen into whatever shape he eats! But to save the family circus, he'll have to keep them out of his evil uncle's hands."
s2209,Movie,Dragons: Rescue Riders: Secrets of the Songwing,"Greg Rankin, TJ Sullivan","Noah Kaye Bentley, Brennley Brown, Zach Callison, Nicolas Cantu, Skai Jackson, Marsai Martin, Andre Robinson, Carlos Alazraqui, Renée Elise Goldsberry",United States,"July 24, 2020",2020,TV-Y,46 min,"Children & Family Movies, Comedies","When a musical dragon with a beautiful voice hypnotizes the dragons and people of Huttsgalor, the Rescue Riders have to find a way to break the spell."
s2214,Movie,The Kissing Booth 2,Vince Marcello,"Joey King, Joel Courtney, Jacob Elordi, Molly Ringwald, Taylor Zakhar Perez, Maisie Richardson-Sellers, Meganne Young","United Kingdom, United States","July 24, 2020",2020,TV-14,133 min,"Comedies, Romantic Movies","With college decisions looming, Elle juggles her long-distance romance with Noah, changing relationship with bestie Lee and feelings for a new classmate."
s2216,Movie,The Larva Island Movie,Ahn Byoung-wook,"Hong Bum-ki, Eddy Lee, Kang Shi-hyun, Ahn Hyo-min, Kim Yeon-woo, Choi Nak-yoon, Tom Wayland, Erica Schroeder",South Korea,"July 23, 2020",2020,TV-Y7,91 min,"Children & Family Movies, Comedies","In this movie sequel to the hit series, Chuck returns home and talks to a reporter about life on the island with zany larva pals Red and Yellow."
s2219,TV Show,Norsemen,,"Kåre Conradi, Silje Torp, Nils Jørgen Kaalstad, Marian Saastad Ottesen, Trond Fausa, Kristine Riis, Jon Øigarden, Henrik Mestad, Øystein Martinsen, Mikkel Bratt Silset, Mads Jørgensen, Nikis Theophilakis",Norway,"July 22, 2020",2020,TV-MA,3 Seasons,"International TV Shows, TV Comedies","The residents of an 8th-century Viking village experience political rivalry, social change and innovations that upend their culture and way of life."
s2232,Movie,The Millions,"Toka McBaror, Tunde Apalowo","Ramsey Nouah, Blossom Chukwujekwu, Ayo Makun, Nancy Isime, Ali Nuhu, Folusho Durojaiye, Toyin Abraham, Chika Lann, Broda Shaggi, Etinosa Idemudia",Nigeria,"July 17, 2020",2019,TV-MA,95 min,"Comedies, International Movies","To pull off a massive heist, a charismatic con artist attempts to rob a fortified home with the help of a team he can't completely trust."
s2234,Movie,MILF,Axelle Laffont,"Virginie Ledoyen, Marie-Josée Croze, Axelle Laffont, Matthias Dandois, Victor Meutelet, Waël Sersoub, Florence Thomassin","France, Belgium","July 16, 2020",2018,TV-MA,102 min,"Comedies, International Movies, Romantic Movies","In the south of France, three best friends in their 40s navigate loss and heartbreak while embarking on steamy affairs with much younger men."
s2237,Movie,Little Singham: Legend of Dugabakka,,,,"July 15, 2020",2020,TV-Y7,68 min,"Children & Family Movies, Comedies","As fears rise over a ghost known for nighttime abductions, Mirchi Nagar residents look to the only person they know can save them: Little Singham!"
s2239,TV Show,Sunny Bunnies,,"Svetlana Tsimokhina, Dmitri Davidovich",Belarus,"July 15, 2020",2016,TV-Y,2 Seasons,"British TV Shows, Kids' TV, TV Comedies","Furry little bunnies hop through wild adventures as they find solutions, fun and sometimes mischief wherever there is light."
s2241,Movie,The Players,Stefano Mordini,"Valerio Mastandrea, Riccardo Scamarcio, Laura Chiatti, Valentina Cervi, Marina Foïs, Euridice Axen, Massimiliano Gallo, Alessia Giuliani",Italy,"July 15, 2020",2020,TV-MA,89 min,"Comedies, International Movies","From campy lies to sexy surprises, this collection of vignettes captures the follies of several men as they fumble with fidelity and relationships."
s2248,Movie,Mama's Boy,Amro Salah,"Hesham Maged, Shikoo, Mohammed Tharwat, Mahmoud Ellisy, Ahmed Sultan, Noor Kadri",Egypt,"July 10, 2020",2018,TV-14,101 min,"Comedies, International Movies",A man undergoes a heart transplant following a serious injury and begins to take on some of the donor's motherly characteristics.
s2250,TV Show,The Epic Tales of Captain Underpants in Space,,"Nat Faxon, Jay Gragnani, Ramone Hamilton, Sean Astin, Dayci Brookshire, Jorge Diaz, Peter Hastings, Evan Kishiyama, David Koechner, Erica Luttrell, Brennan Murray, Nolan North, Gary Anthony Williams, Secunda Wood",United States,"July 10, 2020",2020,TV-Y7,1 Season,"Kids' TV, TV Action & Adventure, TV Comedies",Best friends George and Harold — along with their classmates and tyrannical principal — are recruited for a mysterious mission in outer space.
s2253,Movie,Your Excellency,Funke Akindele,"Akin Lewis, Funke Akindele, Kemi Lala Akindoju, Shaffy Bello, Kunle Coker, Eku Edewor, Alexx Ekubo, Osas Ighodaro Ajibade, Seyi Law, Falz, Chigul, Deyemi Okanlawon, Beverly Osu, Toni Tones, Christian Paul, Bimbo Manuel, Helen Paul",,"July 10, 2020",2019,TV-G,120 min,"Comedies, International Movies","Bumbling through politics, a billionaire businessman's presidential campaign seems destined for disaster until it gets a boost from social media."
s2260,Movie,The Long Dumb Road,Hannah Fidell,"Tony Revolori, Jason Mantzoukas, Taissa Farmiga, Grace Gummer, Ciara Bravo, Casey Wilson, Pamela Reed, Ron Livingston",United States,"July 8, 2020",2018,R,91 min,"Comedies, Independent Movies","Bound for art school, a sheltered student gets roped into the antics of a freewheeling mechanic who hitches a ride after fixing his car."
s2265,Movie,Aiyyaa,Sachin Kundalkar,"Rani Mukerji, Prithviraj Sukumaran, Nirmiti Sawant, Subodh Bhave, Jyoti Subhash, Satish Alekar, Anita Date, Amey Wagh, Kishori Balal, Pakoda Pandi",India,"July 5, 2020",2012,TV-14,151 min,"Comedies, International Movies, Music & Musicals","An outspoken, imaginative girl from a conservative family pursues her dream man while fending off the prospect of an arranged marriage."
s2266,Movie,Bbuddah Hoga Terra Baap,Puri Jagannadh,"Amitabh Bachchan, Hema Malini, Raveena Tandon, Sonu Sood, Sonal Chauhan, Charmy Kaur, Prakash Raj, Makrand Deshpande, Subbaraju, Shawar Ali, Rajeev Verma",India,"July 5, 2020",2011,TV-14,116 min,"Action & Adventure, Comedies, Dramas","A cooly confident aging hit man returns from exile in Paris to his old city, Mumbai, to revisit his past and perform one last job."
s2269,Movie,Boss,Anthony D'Souza,"Akshay Kumar, Ronit Roy, Shiv Pandit, Mithun Chakraborty, Johny Lever, Aditi Rao Hydari, Danny Denzongpa, Govind Namdeo, Parikshat Sahni, Aakash Dabhade",India,"July 5, 2020",2013,TV-14,139 min,"Action & Adventure, Comedies, Dramas","Disowned by his father as a boy, Surya is taken in by a crime boss. When his brother Shiv is wrongly imprisoned, his father pleads for Surya's help."
s2271,Movie,Chashme Baddoor,David Dhawan,"Rishi Kapoor, Ali Zafar, Taapsee Pannu, Siddharth, Divyendu Sharma, Anupam Kher, Bharati Achrekar, Lillete Dubey, Ayaz Khan",India,"July 5, 2020",2013,TV-14,121 min,"Comedies, International Movies, Music & Musicals","When pretty new neighbor Seema falls for their shy roommate Sid, jealous womanizers Omi and Jai plot to break up the new lovebirds."
s2272,Movie,Dharam Sankat Mein,Fuwad Khan,"Paresh Rawal, Annu Kapoor, Alka Badola Kaushal, Auritra Ghosh, Naseeruddin Shah, Manoj Raghubir Sharma, Rushita Pandya, Murli Sharma",India,"July 5, 2020",2015,TV-PG,127 min,"Comedies, Dramas, International Movies","After learning he was adopted from a Muslim couple, a Hindu man seeks his birth father but finds he must confront his bigotry to realize his quest."
s2275,Movie,Gollu Aur Pappu,Kabir Sadanand,"Vir Das, Sandeepa Dhar, Dimple Kapadia, Kunaal Roy Kapur, Deepak Tijori",India,"July 5, 2020",2014,TV-14,112 min,"Action & Adventure, Comedies, International Movies","Hapless brothers Gollu and Pappu stumble into a terrorist plot and end up being ordered to detonate a bomb, a task they are destined to bungle."
s2276,TV Show,Hook,Rachit Kusonkoonsiri,"Peemapol Panichtamrong, Phiravich Attachitsataporn, Thime Pichitsurakit, Jidapa Siribunchawan, Yanin Opassathaworn, Jaturong Kolimart, Pete Thongchua, Ratchanont Sukpragawp, Kanyaphak Pongsak, Kittikun Tansuhas, Tanawat Cheawaram, Toru Takizawa, Noraworn Puangumpai",Thailand,"July 5, 2020",2020,TV-MA,1 Season,"International TV Shows, Romantic TV Shows, TV Comedies","Despite their fathers' rivalry, two university students form a friendship at a boxing gym as they tackle family drama, romance and personal crises."
s2281,Movie,Mumbai Delhi Mumbai,Satish Rajwade,"Shiv Pandit, Piaa Bajpai",India,"July 5, 2020",2014,TV-MA,107 min,"Comedies, International Movies, Romantic Movies","In Delhi for the first time, a Mumbai girl loses her phone but gets a surprise chance at true love with a local boy who begrudgingly helps her."
s2282,Movie,Oh My God,Umesh Shukla,"Akshay Kumar, Paresh Rawal, Mithun Chakraborty, Om Puri, Apoorva Arora, Arun Bali, Honey Chaaya, Poonam Jhawer, Mahesh Manjrekar, Govind Namdeo",India,"July 5, 2020",2012,TV-PG,129 min,"Comedies, Dramas, International Movies",Mumbai shopkeeper Kanji Bhai files a lawsuit against God when an earthquake destroys his store and his insurance policy won't cover the damage.
s2283,Movie,One by Two,Devika Bhagat,"Abhay Deol, Preeti Desai, Lillete Dubey, Rati Agnihotri, Jayant Kripalani, Darshan Jariwala, Anish Trivedi, Geetika Tyagi, Preetika Chawla, Tahir Raj Bhasin",India,"July 5, 2020",2014,TV-14,135 min,"Comedies, Dramas, International Movies",The lives of a Mumbai man and woman who are both dealing with issues intersect through a TV dance show that she wants to win but he wants to sabotage.
s2287,Movie,Pyaar Ka Punchnama 2,Luv Ranjan,"Kartik Aaryan, Nushrat Bharucha, Sonalli Sehgall, Sunny Singh, Ishita Raj, Omkar Kapoor, Sharat Saxena, Mona Ambegaonkar",India,"July 5, 2020",2015,TV-MA,136 min,"Comedies, Dramas, International Movies",Three young bachelors find the reality of relationships to be far removed from the idea of true romance that they had once pursued.
s2288,Movie,Queen,Vikas Bahl,"Kangana Ranaut, Rajkummar Rao, Lisa Haydon, Mish Boyko, Jeffrey Chee Eng Ho, Marco Canadea, Sabeeka Imam, Yogendra Tikku",India,"July 5, 2020",2014,TV-MA,138 min,"Comedies, Dramas, International Movies","Dumped by her fiancé, a sheltered young woman decides to go on her honeymoon to Europe alone, embarking on an exhilarating journey of self-discovery."
s2291,Movie,Tanu Weds Manu,Aanand Rai,"Madhavan, Kangana Ranaut, Jimmy Shergill, Deepak Dobriyal, Swara Bhaskar, Eijaz Khan, K.K. Raina, Rajendra Gupta, Ravi Kishan, Navni Parihar",India,"July 5, 2020",2011,TV-14,114 min,"Comedies, Dramas, International Movies","When London-based doctor Manu reluctantly returns to India to find a bride, he meets the girl of his dreams – only to discover she loves another man."
