show_id,type,title,director,cast,country,date_added,release_year,rating,duration,listed_in,description
s6246,Movie,Barrio Universitario,Esteban Vidal,"Fabrizio Copano, Rodrigo Salinas, Pedro Ruminot, Sergio Freire, Juanita Ringeling, Alessandra Denegri, Luis Dubó, Felipe Avello",Chile,"August 19, 2018",2013,TV-14,91 min,"Comedies, International Movies",Four friends from a humble technical school compete against the elite students of a prestigious university in a robot-building contest.
s6248,Movie,BASEketball,David Zucker,"Trey Parker, Matt Stone, Dian Bachar, Yasmine Bleeth, Jenny McCarthy, Ernest Borgnine, Robert Vaughn, Trevor Einhorn",United States,"November 1, 2018",1998,R,103 min,"Comedies, Sports Movies","When two slackers' made-up sport, BASEketball, becomes a national craze, they hope to cash in on the basketball/baseball hybrid's popularity."
s6253,TV Show,Battle Creek,,"Josh Duhamel, Dean Winters, Aubrey Dollar, Edward Fordham Jr., Kal Penn, Janet McTeer, Liza Lapira, Damon Herriman, Meredith Eaton",United States,"December 31, 2015",2015,TV-14,1 Season,"Crime TV Shows, TV Comedies, TV Dramas","A polished FBI agent must team up with a cynical cop when he's dispatched to Battle Creek, Michigan, to set up an office at the local precinct."
s6255,Movie,Bawarchi,Hrishikesh Mukherjee,"Rajesh Khanna, A.K. Hangal, Durga Khote, Jaya Bhaduri, Kali Bannerjee, Usha Kiran, Asrani, Paintal",India,"December 31, 2019",1972,TV-PG,125 min,"Classic Movies, Comedies, Dramas",A dysfunctional middle-class family is transformed by the attentions of their talented new chef – until he vanishes along with their valuable jewels.
s6258,Movie,Be Somebody,Joshua Caldwell,"Matthew Espinosa, Sarah Jeffery, Allison Paige, Tava Smiley, Caitlin Keats, LaMonica Garrett, Mahaley Patel, Mason McCulley, Liana Ramirez",United States,"November 20, 2019",2016,PG,88 min,"Comedies, Dramas, Romantic Movies","To escape the stress of fame, teen pop star Jordan goes incognito in a small town, where he forms a special bond with high school art student Emily."
s6261,Movie,Bean: The Ultimate Disaster Movie,Mel Smith,"Rowan Atkinson, Peter MacNicol, John Mills, Pamela Reed, Harris Yulin, Burt Reynolds, Larry Drake, Danny Goldring, Johnny Galecki, Chris Ellis, Andrew Lawrence, Peter Egan, Peter Capaldi, June Brown, Peter James, Sandra Oh","United Kingdom, United States","August 1, 2018",1997,PG-13,89 min,"Comedies, International Movies","Disaster-prone Mr. Bean is sent to Los Angeles to guard a famous painting, but as he's unfit for any physical task, everything goes hilariously wrong."
s6266,TV Show,Beauty and the Bitches,,"Methinee Kingpayome, Son Songpaisarn, Yingying Sarucha, Pim Pimjira Jaroenlak, Jespipat Tilapornputt, Groupz Chutharut Anusin, Aon Korakot Tunkaew, Raviyanun Takerd, Nat Thephussadin Na Ayutthaya, Bam Pakakanya Charoenyos, Eye Warapairin Laphatsanitirot, Pemy Peramin Thabkaew, Darin Hansen, Hongyok Pornphan Rerkatakarn, Rattanapond Klinkulabhiran, Oliver Pupart, Organ Wacharapolmek, Patiparn Pataweekarn, Yuthana Puengklarng, Ak Akarat, Point Cholawit Meetongcom, Copter Phumin, Koii Korakod, Mila Thanapa, Mild Anis Suwit",,"April 23, 2019",2016,TV-MA,2 Seasons,"International TV Shows, Romantic TV Shows, TV Comedies",Beauty pageant contestants from all over Thailand fight for the crown as they contend with drama and intrigue behind the scenes.
s6267,Movie,Beavis and Butt-head Do America,Mike Judge,"Mike Judge, Bruce Willis, Demi Moore, Cloris Leachman, Robert Stack, Jacqueline Barba, Pamela Blair, Eric Bogosian, Kristofor Brown, Tony Darling, David Letterman",United States,"November 20, 2019",1996,PG-13,81 min,"Comedies, Cult Movies","After realizing that their boob tube is gone, Beavis and Butt-head set off on an expedition that takes them from Las Vegas to the nation's capital."
s6268,Movie,Bebe's Kids,Bruce W. Smith,"Faizon Love, Vanessa Bell Calloway, Wayne Collins, Jonell Green, Marques Houston, Tone-Loc, Myra J., Nell Carter",United States,"November 20, 2019",1992,PG-13,73 min,Comedies,"When ladies' man Robin meets Jamika, he falls head over heels, but she greets him with four surprises: her son and her girlfriend Bebe's three kids."
s6269,Movie,Because of Soccer,"Agasyah Karim, Khalid Kashogi","Herjunot Ali, Winky Wiryawan, Erly Ashy, Laura Basuki, Tarzan, Aida Nurmala, Otto Djauhari, Indra Herlambang",Indonesia,"December 8, 2018",2008,TV-14,75 min,"Comedies, Dramas, International Movies","After losing a World Cup bet, two hapless buddies must use their wits to pay off their debt to a big Jakarta bookie in this action-packed comedy."
s6270,Movie,Because We're Heading Out,Khaled El Halafawy,"Hassan El Raddad, Emy Samir Ghanim, Bayyumi Fuad, Taher Abu Lela, Nesreen Ameen, Mourad Makram, Diaa El-Merghani, Juditta Salem-Wolff",Egypt,"April 18, 2019",2016,TV-14,99 min,"Comedies, International Movies",Trouble and high jinks ensue when a man and woman stumble on a bag full of money while out on the town.
s6272,Movie,Bedtime Stories,Adam Shankman,"Adam Sandler, Keri Russell, Guy Pearce, Russell Brand, Richard Griffiths, Jonathan Pryce, Courteney Cox, Lucy Lawless, Teresa Palmer, Aisha Tyler, Laura Ann Kesling, Jackie Sandler, Lorna Scott, Dana Min Goodman, Andrew Collins, Jonathan Loughran, Jonathan Morgan Heit, Nick Swardson, Tim Herlihy, Billy Tyler, Johntae Lipscomb, Mikey Post, Sebastian Saraceno, Bill Romanowski, Sadie Sandler, Carmen Electra, Allen Covert, Kathryn Joosten, Annalise Basso, Blake Clark, Julia Lea Wolov, Sarah G. Buxton",United States,"March 5, 2019",2008,PG,100 min,"Children & Family Movies, Comedies",Skeeter's life is turned upside down when the fantastical stories he makes up to entertain his niece and nephew inexplicably turn into reality.
s6286,Movie,Berlin Kaplani,Hakan Algül,"Ata Demirer, Necati Bilgiç, Tarık Ünlüoğlu, Özlem Türkad, Nihal Yalçın, Cemil Özbayer, Cengiz Bozkurt, Orhan Güner, Mert Aran",Turkey,"March 10, 2017",2012,TV-14,99 min,"Comedies, International Movies, Sports Movies","After a losing streak puts him in debt of 50,000 euros to his sponsors, an unlikely Turkish-German boxer in Berlin finds himself in need of a miracle."
s6288,Movie,Best Neighbors,Tamer Bassiouni,"Sameh Hussain, Menna Arafa, Merna al-Mohandes",,"June 6, 2019",2014,TV-14,98 min,"Comedies, International Movies","A just-married couple moves into their new home, finding themselves at war with the kids next door, who seem determined to make their lives miserable."
s6291,Movie,Bewildered Bolbol,Khaled Marei,"Ahmed Helmy, Zeina, Shery Adel, Emy Samir Ghanim, Yousef Fawzy, Yasser El Tobgy, Wael Sami, Maryam Saleh",Egypt,"June 20, 2019",2010,TV-14,112 min,"Comedies, International Movies, Romantic Movies",A man suffering from amnesia can't seem to choose between the women playing tricks on him.
s6295,TV Show,Bh Se Bhade,,"Deven Bhojani, Suchita Trivedi, Sarita Joshi, Varun Khandelwal, Bhavna Khatri, Dushyant Wagh, Gulfam Khan, Atul Parchure",India,"April 1, 2018",2013,TV-PG,1 Season,"International TV Shows, TV Comedies","A kind-hearted insurance agent has the mysterious power to temporarily shoulder the problems and pain of others, with comic results in his own life."
s6297,Movie,Bhagam Bhag,Priyadarshan,"Akshay Kumar, Govinda, Lara Dutta, Paresh Rawal, Rajpal Yadav, Jackie Shroff, Arbaaz Khan, Tanushree Dutta, Asrani, Shakti Kapoor",India,"December 31, 2019",2006,TV-14,151 min,"Comedies, International Movies, Romantic Movies","A theater group lands in trouble when its new actress takes her own life, two of its members are framed for murder and no one is who they appear to be."
s6302,TV Show,Big Bad Beetleborgs,,"Wesley Barker, Herbie Baez, Elisabeth Lund, Shannon Chandler, Billy Forester, Frank Addela, Kyle Jordan, Dave 'Foots' Footman, Derek Stephen Prince, Vivian Smallwood","United States, France, Japan","January 1, 2016",1997,TV-G,2 Seasons,"Kids' TV, TV Comedies","When three teens free a spirit that offers to grant each a wish, they choose to become their favorite superheroes, launching a series of adventures."
s6303,Movie,Big Bear,Joey Kern,"Joey Kern, Adam Brody, Zachary Knighton, Tyler Labine, Pablo Schreiber, Toby Huss, Heidi Heaslet, Ahna O'Reilly",United States,"February 28, 2018",2017,TV-MA,87 min,Comedies,The alcohol-fueled high jinks of a bachelor party go haywire when the buddies of an ill-fated groom abduct his fiancée's new lover.
s6304,Movie,Big Daddy,Dennis Dugan,"Adam Sandler, Joey Lauren Adams, Jon Stewart, Cole Sprouse, Dylan Sprouse, Josh Mostel, Leslie Mann, Allen Covert, Rob Schneider, Kristy Swanson",United States,"October 1, 2020",1999,PG-13,93 min,Comedies,"Dumped by his girlfriend because he refuses to accept responsibility, overgrown adolescent Sonny Koufax adopts a 5-year-old to prove he's a grownup."
s6306,Movie,Big Fat Liar,Shawn Levy,"Frankie Muniz, Paul Giamatti, Amanda Bynes, Amanda Detmer, Donald Faison, Sandra Oh, Russell Hornsby, Michael Bryan French, Christine Tucci, Lee Majors, John Cho","United States, Germany","January 15, 2020",2002,PG,88 min,"Children & Family Movies, Comedies",Junior high students Jason and Kaylee take action when a greedy Hollywood producer turns Jason's essay into a hit film without giving him credit.
s6309,Movie,Bigger Fatter Liar,Ron Oliver,"Ricky Garcia, Jodelle Ferland, Barry Bostwick, Fiona Vroom, Kevin O'Grady, Karen Holness",United States,"April 18, 2017",2017,PG,95 min,"Children & Family Movies, Comedies","When his video game concept is stolen by a dishonest executive, a teenage chronic liar sets out to prove that he's telling the truth, for once."
s6316,Movie,Birthmarked,Emanuel Hoss-Desmarais,"Toni Collette, Matthew Goode, Andreas Apergis, Michael Smiley, Fionnula Flanagan, Suzanne Clément, Jordan Poole, Megan O'Kelly, Anton Gillis-Adelman, Tyrone Benskin, Vincent Hoss-Desmarais",Canada,"June 28, 2018",2018,TV-MA,88 min,"Comedies, Independent Movies, International Movies","In an attempt to settle the ""nature vs. nurture"" debate, a scientist couple raises three children to live lives that defy their genetic dispositions."
s6317,Movie,Bitch,Marianna Palka,"Jason Ritter, Jaime King, Marianna Palka, Brighton Sharbino, Rio Mangini, Jason Maybaum, Kingston Foster, Arielle Kebbel, Martin Starr, Roger Guenveur Smith, Caroline Aaron, Bill Smitrovich",United States,"March 11, 2018",2017,R,97 min,"Comedies, Dramas, Independent Movies","Cracking under the demands of children and a philandering, thankless husband, an overworked suburban mother assumes the persona of a ferocious dog."
s6318,Movie,Bitcoin Heist,Ham Tran,"Kate Nhung, Thanh Pham, Petey Majik Nguyen, Suboi, Jayvee Mai The Hiep, Lam Thanh My",Vietnam,"September 2, 2017",2016,TV-14,116 min,"Action & Adventure, Comedies, International Movies","A unconventional, efficient Interpol special agent goes rogue and assembles a team of thieves to catch a shadowy hacker called ""The Ghost."""
s6321,Movie,Bittoo Boss,Supavitra Babul,"Pulkit Samrat, Ashok Pathak, Tanvir Singh, Amita Pathak, Sunil Shetty, Rajendra Sethi, Mohan Kapoor",India,"July 5, 2020",2012,TV-14,117 min,"Comedies, Dramas, International Movies","When a small-town wedding videographer falls in love, he decides he needs to make more money and turns to shooting sexy videos – with mixed results."
s6335,Movie,Blockbuster,July Hygreck,"Syrus Shahidi, Lionel Abelanski, Charlotte Gabris, Tom Hygreck, Sylvain Quimene, Laura Boujenah, Foed Amara",France,"January 24, 2018",2017,TV-MA,85 min,"Comedies, Independent Movies, International Movies","Dumped over a video he made to amuse his ailing dad, a heartsick Jérémy hatches an elaborate scheme to win back his superhero-loving girlfriend, Lola."
s6340,Movie,Blue Jasmine,Woody Allen,"Cate Blanchett, Sally Hawkins, Alec Baldwin, Louis C.K., Bobby Cannavale, Andrew Dice Clay, Peter Sarsgaard, Michael Stuhlbarg, Tammy Blanchard, Max Casella, Alden Ehrenreich",United States,"March 8, 2019",2013,PG-13,98 min,"Comedies, Dramas, Independent Movies",The high life leads to high anxiety for a fashionable New York City homemaker in crisis who finds herself forced to live a more modest lifestyle.
s6341,Movie,Blue Mountain State: The Rise of Thadland,Lev L. Spiro,"Alan Ritchson, Darin Brooks, James Cade, Rob Ramsay, Chris Romano, Frankie Shaw, Omari Newton, Ed Marinaro, Dhani Jones, Ed Amatrudo, Jimmy Tatro",United States,"March 1, 2016",2016,R,90 min,Comedies,"New NFL star Thad buys his old teammates' beloved frat house, renames it Thadland and throws the raunchiest, most debauched party in school history."
s6344,Movie,Blue Streak,Les Mayfield,"Martin Lawrence, Luke Wilson, Peter Greene, Dave Chappelle, Nicole Ari Parker, Graham Beckel, Robert Miranda, Olek Krupa, Saverio Guerra, Richard C. Sarafian, William Forsythe","Germany, United States","January 1, 2021",1999,PG-13,94 min,"Action & Adventure, Comedies",A jewel thief returns to his hiding place after a stint in jail — only to find that his diamond is buried under a newly constructed police station.
s6355,Movie,Bolt,"Byron Howard, Chris Williams","John Travolta, Miley Cyrus, Susie Essman, Mark Walton, Malcolm McDowell, James Lipton, Greg Germann, Diedrich Bader, Nick Swardson, J.P. Manoux, Dan Fogelman, Kari Wahlgren, Chloë Grace Moretz, Randy Savage, Ronn Moss, John DiMaggio, Daran Norris, Jeff Bennett, Brian Stepanek, Todd Cummings",United States,"July 22, 2018",2008,PG,99 min,"Children & Family Movies, Comedies","This tale follows German shepherd Bolt, a canine actor who makes a cross-country trek when he's mistakenly shipped from Hollywood to New York City."
s6357,Movie,Bon Bini Holland,Jelle de Jonge,"Jandino Asporaat, Liliana de Vries, Teun Kuilboer, Sergio IJssel, Dennis Rudge, Alpha Oumar Barry, Phi Nguyen",Netherlands,"September 1, 2016",2015,TV-MA,88 min,"Comedies, International Movies","On the island of Curaçao, an amiable scam artist angers gangsters and flees to Holland, where his conscience is torn between a woman and a new scheme."
s6362,TV Show,Borderline,,"David Avery, Jackie Clune, David Elms, Liz Kingsman, Jamie Michie",United Kingdom," December 2, 2017",2017,TV-14,2 Seasons,"British TV Shows, TV Comedies",A team of inept border agents tackles immigration issues at the fictional Northend Airport in this improvised mockumentary series.
s6368,Movie,Boy Bye,Chris Stokes,"Wendy Raquel Robinson, Ross Fleming, Shondrella Avery, Tammy Townsend, Omar Gooding, Tracy Davis, Veronika Bozeman, Kelly Perine, Valarie Pettiford",United States,"April 2, 2019",2016,TV-MA,86 min,"Comedies, Romantic Movies","Single entrepreneur Veronica finally starts to believe in love after meeting sexy Lance, but she soon discovers he's hiding something from her."
s6371,Movie,Bratz: The Movie,Sean McNamara,"Logan Browning, Janel Parrish, Nathalia Ramos, Skyler Shaye, Chelsea Kane",United States,"June 29, 2020",2007,PG,102 min,"Children & Family Movies, Comedies","When high school hierarchy divides four best friends into different cliques, the girls defy expectations and try to bring their groups together."
s6373,Movie,Brave New Jersey,Jody Lambert,"Tony Hale, Anna Camp, Sam Jaeger, Heather Burns, Dan Bakkedahl, Raymond J. Barry, Erika Alexander, Mel Rodriguez, Evan Jonigkeit, Grace Kaufman",United States,"December 15, 2017",2016,TV-MA,92 min,"Comedies, Independent Movies",Small-town residents mistake an Orson Welles radio broadcast for news about an alien invasion and are emboldened to act as they await an apocalypse.
s6378,Movie,Bring It On: Worldwide Showdown,Robert Adetuyi,"Cristine Prosperi, Jordan Rodrigues, Gia Re, Sophie Vavasseur, Sven Ruygrok, Stephan Lee Benson, Natalie Walsh, Vivica A. Fox",United States,"August 29, 2017",2017,PG-13,95 min,Comedies,"When cheerleading champs the Rebels are challenged by an edgy new squad, they take on teams from all over the world in a virtual cheer battle."
s6382,TV Show,Brown Nation,,"Rajeev Varma, Shenaz Treasury, Kapil Bawa, Remy Munasifi, Omi Vaidya, Melanie Chandra, Sana Serrai, Jonathan Horvath, Akaash Singh",United States,"November 15, 2016",2016,TV-14,1 Season,TV Comedies,An Indian American man living with his artistic wife and contentious father-in-law struggles to handle his household and a foundering IT company.
s6383,Movie,Bruno and Boots: Go Jump in the Pool,Vivieno Caldinelli,"Jonny Gray, Callan Potter, Peter Keleghan, Hannah Vandenbygaart, Kiana Madeira, Joshua Kilimnik, Drew Haytaoglu, Isiah Lea, Scott Thompson, Caroline Rhea",Canada,"June 24, 2017",2016,TV-PG,91 min,"Children & Family Movies, Comedies","To keep pal Boots from being sent to a rival school with better athletics, prankster Bruno leads an epic campaign to build a pool at Macdonald Hall."
s6384,Movie,Bruno and Boots: The Wizzle War,Vivieno Caldinelli,"Jonny Gray, Callan Potter, Matt Baram, Caroline Rhea, Kiana Madeira",Canada,"July 1, 2017",2017,TV-PG,90 min,"Children & Family Movies, Comedies","Fed up with weird dress codes and wacky punishments, the students of neighboring schools face off against two recently hired oddball authoritarians."
s6385,Movie,Bruno and Boots: This Can't Be Happening at Macdonald Hall,Vivieno Caldinelli,"Jonny Gray, Callan Potter, Peter Keleghan, Caroline Rhea",Canada,"June 24, 2017",2017,TV-PG,90 min,"Children & Family Movies, Comedies","The biggest troublemakers at Macdonald Hall are Bruno and Boots, who are caught and face an unthinkable punishment: separation into different dorms."
s6394,TV Show,Burnistoun,,"Iain Connell, Robert Florence, Kirsty Strain, Richard Rankin, Allan Miller, Louise Stewart",United Kingdom," October 1, 2019",2012,TV-MA,2 Seasons,"British TV Shows, TV Comedies","This sketch series focuses on the eccentric characters in a small Scottish town, including bumbling cops, ""DJ Jesus"" and a disgruntled serial killer."
s6401,Movie,Caida del Cielo,Néstor Sánchez Sotelo,"Muriel Santa Ana, Peto Menahem, Héctor Díaz, Sebastián Wainraich, Karina K., Hernán Jiménez, Fabián Forte, Verónica Intile",Argentina,"January 20, 2017",2016,TV-MA,78 min,"Comedies, International Movies, Romantic Movies","When Julia literally falls into Alejandro's backyard from her apartment above, it's just the jolt that's needed to nudge these two loners together."
s6403,Movie,Cake,Asim Abbasi,"Aamina Sheikh, Sanam Saeed, Adnan Malik, Mohammad Ahmad, Beo Rana Zafar, Faris Khalid, Hira Hussain, Mikaal Zulfiqar","United Kingdom, Pakistan","May 15, 2019",2018,TV-MA,125 min,"Comedies, Dramas, International Movies","When their aging father’s illness reunites two sisters under one roof, new tensions arise between them as old wounds and hidden secrets surface."
s6410,Movie,Camera Store,Scott Marshall Smith,"John Larroquette, John Rhys-Davies, Paul Ben-Victor, David James Elliott, Laura Silverman, Cheryl Ladd, Justin Lieberman, Maddie McCormick",United States,"August 20, 2017",2016,TV-MA,104 min,"Comedies, Dramas","With the digital revolution just around the corner, the employees of Bibideaux camera store strive to stay relevant amid unstoppable change."
s6411,Movie,Camp Cool Kids,Lisa Arnold,"Connor Rosen, Logan Shroyer, Michael Gross, Markie Post, Leigh-Allyn Baker, Juliocesar Chavez, Tyree Brown",United States,"January 1, 2018",2017,TV-G,104 min,"Children & Family Movies, Comedies, Dramas","A young boy attends summer camp, where he overcomes his fears, stands up to bullies and learns important lessons about faith and life."
s6415,Movie,Can't Hardly Wait,"Harry Elfont, Deborah Kaplan","Jennifer Love Hewitt, Ethan Embry, Charlie Korsmo, Lauren Ambrose, Peter Facinelli, Seth Green, Michelle Brookhurst, Alexander Martin, Erik Palladino, Channon Roe, Sean Patrick Thomas",United States,"January 1, 2021",1998,PG-13,101 min,"Comedies, Romantic Movies","At a wild high school graduation party, aspiring writer Preston hopes to declare his love to popular girl Amanda, who just got dumped by the class jock."
s6419,Movie,Cappuccino,Noushad,"Dharmajan Bolgatty, Aneesh Menon, Sunil Sukhada, Anita Lukmance, Kottayam Pradeep, Natasha Doshi, Hareesh Perumanna, Sharanya, Vineeth Mohan, Sudhi Koppa",India,"July 1, 2018",2017,TV-PG,126 min,"Comedies, Dramas, International Movies","Richi is a director of commercials whose computer memory drive is accidentally switched with that of Sneha, a woman he soon falls in love with."
s6426,Movie,Casa de mi Padre,Matt Piedmont,"Will Ferrell, Gael García Bernal, Diego Luna, Genesis Rodriguez, Pedro Armendáriz Jr., Nick Offerman, Efren Ramirez, Adrian Martinez","United States, Mexico","November 14, 2012",2012,R,84 min,Comedies,Will Ferrell stars as a Spanish-speaking cowboy in this comedy about a Mexican clan trying to rescue their ranch from greedy creditors.
s6431,TV Show,Castle of Stars,,"Chaiyapol Pupart, Jintanutda Lummakanon, Worrawech Danuwong, Ornjira Lamwilai, Yong Armchair, Keerati Mahapreukpong, Akarat Nimitchai, Kornpassorn Duaysianklao, Nattapong Chartpong",,"September 7, 2018",2015,TV-MA,1 Season,"International TV Shows, Romantic TV Shows, TV Comedies","As four couples with different lifestyles go through the ebbs and flows of joy and sorrow, each must learn how to live a good life."
s6434,Movie,Cats & Dogs: The Revenge of Kitty Galore,Brad Peyton,"James Marsden, Nick Nolte, Christina Applegate, Katt Williams, Bette Midler, Neil Patrick Harris, Sean Hayes, Wallace Shawn, Roger Moore, Joe Pantoliano, Michael Clarke Duncan, Chris O'Donnell, Jack McBrayer, Kiernan Shipka","United States, Australia","February 1, 2019",2010,PG,82 min,"Children & Family Movies, Comedies",Cats and dogs must set aside their differences and merge animal instincts when Kitty Galore decides to claw her way to global domination.
s6440,Movie,Chal Dhar Pakad,Aatmaram Dharne,Nagesh Bhonsle,India,"March 15, 2018",2010,TV-14,129 min,"Comedies, Dramas, International Movies","After her fat-shaming husband brings home a new lover, a wife in Maharashtra recruits a group of women to challenge him in a kabaddi match."
s6441,Movie,Chal Mere Bhai,David Dhawan,"Sanjay Dutt, Salman Khan, Karisma Kapoor, Dalip Tahil, Sushma Seth, Shakti Kapoor, Nagma, Sonali Bendre, Twinkle Khanna, Ravi Baswani",India,"December 31, 2019",2000,TV-14,132 min,"Comedies, International Movies, Romantic Movies","When a secretary saves her tycoon boss's life, his family hears wedding bells. Problem is, she's already in love – with his younger brother."
s6442,Movie,Chalay Thay Saath,Umer Adil,"Syra Shehroz, Kent S. Leung, Osama Tahir, Mansha Pasha, Zhalay Sharhadi, Faris Khalid, Behroze Sabzwari, Shamim Hilaly",Pakistan,"May 15, 2018",2017,TV-14,118 min,"Comedies, Dramas, International Movies",Beautiful and adventurous doctor Resham meets a handsome Chinese backpacker named Adam while traveling with friends on a journey of self-discovery.
s6447,Movie,Charlie and the Chocolate Factory,Tim Burton,"Johnny Depp, Freddie Highmore, David Kelly, Helena Bonham Carter, Noah Taylor, Missi Pyle, James Fox, Deep Roy, Christopher Lee, Adam Godley, AnnaSophia Robb, Julia Winter, Jordan Fry, Philip Wiegratz","United Kingdom, United States","January 1, 2020",2005,PG,115 min,"Children & Family Movies, Comedies",The eccentric Willy Wonka opens the doors of his candy factory to five lucky kids who learn the secrets behind his amazing confections.
s6448,Movie,Charlie's Angels: Full Throttle,McG,"Cameron Diaz, Drew Barrymore, Lucy Liu, Bernie Mac, Crispin Glover, Justin Theroux, Robert Patrick, Demi Moore, Rodrigo Santoro, Shia LaBeouf, Matt LeBlanc, Luke Wilson, John Cleese",United States,"October 1, 2019",2003,PG-13,106 min,"Action & Adventure, Comedies","In this reboot of the TV classic, the Angels are tasked with finding lost rings encoded with the personal information of people in witness protection."
s6450,Movie,Chashme Buddoor,David Dhawan,"Ali Zafar, Siddharth, Divyendu Sharma, Tapsee Pannu, Rishi Kapoor, Anupam Kher, Bharati Achrekar, Varun Dhawan, Lillete Dubey, Ayaz Khan, Ashish Verma",India,"May 1, 2017",2013,TV-PG,121 min,"Comedies, International Movies, Music & Musicals","When pretty new neighbor Seema falls for their shy roommate Sid, jealous womanizers Omi and Jai plot to break up the new lovebirds."
s6451,Movie,Chasing Amy,Kevin Smith,"Ben Affleck, Joey Lauren Adams, Jason Lee, Dwight Ewell, Jason Mewes, Kevin Smith",United States,"January 1, 2020",1997,R,113 min,"Comedies, Cult Movies, Dramas","Comic book artist Holden meets the perfect woman, only to learn that she's a lesbian. But that doesn't stop him from falling in love with her."
s6457,TV Show,Cheers,,"Ted Danson, Rhea Perlman, George Wendt, John Ratzenberger, Shelley Long, Kirstie Alley, Woody Harrelson, Kelsey Grammer, Nicholas Colasanto",United States," July 1, 2017",1992,TV-PG,11 Seasons,"Classic & Cult TV, TV Comedies","Sam Malone, an ex-baseball player turned bar owner, operates a saloon that's always filled with quirky customers and even more eccentric staff."
s6460,TV Show,Chewin' the Fat,,"Ford Kiernan, Greg Hemphill, Karen Dunbar, Mark Cox, Paul Riley",United Kingdom,"October 1, 2016",1999,TV-14,1 Season,"British TV Shows, TV Comedies","Petty criminals, dodgy decorators, full-bore Glaswegians and oddball documentary presenters converge in this sketch show that parodies Scottish life."
s6466,Movie,Chicken Kokkachi,Anuranjan Premji,"Anuranjan Premji, Indrans, Dharmajan Bolgatty, Sudhi Koppa, Bijukuttan, Neha Rathanakaran, Prasanth",India,"July 1, 2018",2017,TV-14,113 min,"Comedies, International Movies","In the wake of his sister's marriage, a young middle-class man leaves his village and learns that supporting one's self is easier said than done."
